index,published,keyword,domain,language,valid,title,description,url,image,archive,content,quote,de,en,la,added
006fc4483a789aa769641e17e0a56a89,2025-12-01T06:00:17Z,'landslide',english.gossiplankanews.com,en,0.9,Landslide Strikes Rambukkana,"An emergency landslide incident has been reported in the Rambukkana, Gangekumbura area, and it has been revealed that there is a risk of earth mounds collapsing in the vicinity. Information regarding this disaster situation was reported this morning.Relevant …",https://english.gossiplankanews.com/2025/12/landslide-strikes-rambukkana.html,https://lh3.googleusercontent.com/blogger_img_proxy/AEn0k_sLSRJDJHYbNlyVibjTftac0YsJUMHkeJjz278iqmxU5ln2MFNgDWK1KX01AEWToVQpffsPjEvGjA0rMDgWFI--q_aATLuJLnmo52iiy0_gs5lr4RJuG6jfNFdfQ4Lo9MD3Y9NlqnTsz1HPiMGqzOGGUPaICLk=w1600,,"An emergency landslide incident has been reported in the Rambukkana, Gangekumbura area, and it has been revealed that there is a risk of earth mounds collapsing in the vicinity. Information regarding… [+372 chars]",,"Erdrutsch trifft Rambukkana. Aus der Gegend von Rambukkana, Gangekumbura, wurde ein Notfall-Erdrutschvorfall gemeldet, und es wurde festgestellt, dass in der Umgebung die Gefahr besteht, dass Erdhügel einstürzen. Informationen zu dieser Katastrophensituation wurden heute Morgen gemeldet. Relevante …","Landslide Strikes Rambukkana. An emergency landslide incident has been reported in the Rambukkana, Gangekumbura area, and it has been revealed that there is a risk of earth mounds collapsing in the vicinity. Information regarding this disaster situation was reported this morning.Relevant …","Landslide Ictus Rambukkana. Casus casus subitis in Rambukkana, Gangekumbura relatus est, et manifestatum est periculum esse in vicinia aggerum terrae collabentium. Informationes de hac calamitate condicionem hanc mane nuntiaverunt.Relevant...",2025-12-02 10:22:03+00:00
3df51340020ba11f1be5b0eb92a05a56,2025-12-01T10:41:00Z,'landslide',www.thestar.com.my,en,0.9,Missing M’sian in west Sumatra landslide was travelling to visit relatives,"KUALA LUMPUR: Malaysian citizen Asrul Nizam Apridwson, 30, who went missing following a landslide in Padang Panjang, West Sumatra, Indonesia on Nov 27, was reportedly on his way to visit relatives there. Read full story",https://www.thestar.com.my/news/nation/2025/12/01/missing-msian-in-west-sumatra-landslide-was-travelling-to-visit-relatives,https://apicms.thestar.com.my/uploads/images/2025/12/01/3649997.jpg,,"KUALA LUMPUR: Malaysian citizen Asrul Nizam Apridwson, 30, who went missing following a landslide in Padang Panjang, West Sumatra, Indonesia on Nov 27, was reportedly on his way to visit relatives th… [+1662 chars]",,"Der vermisste M'sian war nach einem Erdrutsch in West-Sumatra unterwegs, um Verwandte zu besuchen. KUALA LUMPUR: Der malaysische Staatsbürger Asrul Nizam Apridwson, 30, der nach einem Erdrutsch in Padang Panjang, West-Sumatra, Indonesien, am 27. November vermisst wurde, war Berichten zufolge auf dem Weg, dort Verwandte zu besuchen. Lesen Sie die ganze Geschichte","Missing M’sian in west Sumatra landslide was travelling to visit relatives. KUALA LUMPUR: Malaysian citizen Asrul Nizam Apridwson, 30, who went missing following a landslide in Padang Panjang, West Sumatra, Indonesia on Nov 27, was reportedly on his way to visit relatives there. Read full story","Missing M'sian in landslide Sumatra occidentali iter ad propinquos visitandos erat. KUALA LUMPUR: Malaysian civis Asrul Nizam Apridwson, XXX, qui absentem secutus est lapsus in Padang Panjang, West Sumatra, Indonesia die 27 novembris, parem in itinere propinquos ibi visitare. Read full story",2025-12-03 10:22:47+00:00
dd789ace71a3540b3960eba848e4c1d2,2025-12-01T12:08:00Z,'landslide rain',www.thestar.com.my,en,0.9,"Three more Malaysians missing after West Sumatra floods, says Wisma Putra","PETALING JAYA: Three more Malaysians have gone missing in the floods and landslides that struck West Sumatra, bringing the total number of missing Malaysians in the disaster to four. Read full story",https://www.thestar.com.my/news/nation/2025/12/01/three-more-malaysians-missing-after-west-sumatra-floods-says-wisma-putra,https://apicms.thestar.com.my/uploads/images/2025/12/01/3650116.JPG,,"PETALING JAYA: Three more Malaysians have gone missing in the floods and landslides that struck West Sumatra, bringing the total number of missing Malaysians in the disaster to four.
In its latest u… [+1304 chars]",,"Drei weitere Malaysier werden nach Überschwemmungen in West-Sumatra vermisst, sagt Wisma Putra. PETALING JAYA: Drei weitere Malaysier sind bei den Überschwemmungen und Erdrutschen in West-Sumatra verschwunden, sodass sich die Gesamtzahl der bei der Katastrophe vermissten Malaysier auf vier erhöht. Lesen Sie die ganze Geschichte","Three more Malaysians missing after West Sumatra floods, says Wisma Putra. PETALING JAYA: Three more Malaysians have gone missing in the floods and landslides that struck West Sumatra, bringing the total number of missing Malaysians in the disaster to four. Read full story","Tres plures Malaysiani absentes post Sumatra Occidentales inundationes, Wisma Putra dicit. PETLING JAYA: Tres plures Malaysiani absentes in inundationibus et prolapsionibus Sumatra Occidentalem percusserunt, numerum Malaysianorum absentis in quattuor cladem afferentes. Read full story",2025-12-03 10:22:47+00:00
961007a2865f6e8da99df7d86f9f1144,2025-12-01T23:00:00Z,'landslide rain',www.thestar.com.my,en,0.9,‘Rain behind Cameron apartment landslide’,"KUANTAN: The recent landslide on a hillside near Block C of the Puncak Arabella apartment in Tanah Rata, Cameron Highlands, is believed to have been caused by continuous rain. Read full story",https://www.thestar.com.my/news/nation/2025/12/02/rain-behind-cameron-apartment-landslide,https://apicms.thestar.com.my/uploads/images/2025/12/02/3650797.jpg,,"KUANTAN: The recent landslide on a hillside near Block C of the Puncak Arabella apartment in Tanah Rata, Cameron Highlands, is believed to have been caused by continuous rain.
The Cameron Highlands … [+898 chars]",,"„Regen hinter dem Erdrutsch in Camerons Wohnung“. KUANTAN: Es wird angenommen, dass der jüngste Erdrutsch auf einem Hügel in der Nähe von Block C der Wohnung Puncak Arabella in Tanah Rata, Cameron Highlands, durch anhaltenden Regen verursacht wurde. Lesen Sie die ganze Geschichte","‘Rain behind Cameron apartment landslide’. KUANTAN: The recent landslide on a hillside near Block C of the Puncak Arabella apartment in Tanah Rata, Cameron Highlands, is believed to have been caused by continuous rain. Read full story","'Pluia post cameram camerae camerae'. KUANTAN: Recens ruina in collis prope Block C in camera Arabella Puncak Tanah Rata, Highland Cameron, continua pluvia causata fuisse creditur. Read full story",2025-12-03 10:22:47+00:00
76e74e278a7a96b66b060d7681b0036a,2025-12-03T06:26:08Z,'landslide rain',en.protothema.gr,en,0.9,72-hour severe weather with heavy rain and thunderstorms: Which areas will be affected,"Warnings issued for increased flood and landslide risk from Thursday through Saturday – Attica also in focus due to limited natural drainage capacity
The post 72-hour severe weather with heavy rain and thunderstorms: Which areas will be affected appeared firs…",https://en.protothema.gr/2025/12/03/72-hour-severe-weather-with-heavy-rain-and-thunderstorms-which-areas-will-be-affected/,https://en.protothema.gr/wp-content/uploads/2025/12/kerkyra-vroxi-mak-1.jpg-1.jpg,,"Greece is expected to be hit by a widespread 72-hour spell of severe weather, starting early Thursday and lasting through Saturday, with heavy rain, thunderstorms, and very strong winds, according to… [+5074 chars]",,"72-Stunden-Unwetter mit Starkregen und Gewittern: Welche Gebiete werden betroffen sein? Warnungen vor erhöhter Überschwemmungs- und Erdrutschgefahr von Donnerstag bis Samstag – Attika aufgrund begrenzter natürlicher Entwässerungskapazität ebenfalls im Fokus
Der Beitrag 72-Stunden-Unwetter mit Starkregen und Gewittern: Welche Gebiete betroffen sein werden, erschien zuerst…","72-hour severe weather with heavy rain and thunderstorms: Which areas will be affected. Warnings issued for increased flood and landslide risk from Thursday through Saturday – Attica also in focus due to limited natural drainage capacity
The post 72-hour severe weather with heavy rain and thunderstorms: Which areas will be affected appeared firs…","72-hora tempestas cum imbribus ac tonitribus gravibus: Quae loca afficientur. Admonitiones pro inundatione aucti et periculi labentis ex Iovis per Saturni - Atticae etiam in umbilico ob capacitatem naturalem limitatam INCILE
Post LXXII horarum tempestas cum gravibus pluviis et tonitribus: Quae areas afficientur apparuerunt abietes…",2025-12-06 10:19:10+00:00
d43ad0b05aa6b2cb7e7339bb9a64c76d,2025-12-03T11:19:00Z,'landslide road',www.thestar.com.my,en,0.9,"Underground water flow caused Jalan Gua Musang-Lojing landslide, says police","GUA MUSANG: The landslide at Jalan Gua Musang-Lojing FT185, Section 107.6 at Pos Blau here early Wednesday (Dec 3) is believed to have been caused by underground water flow, said district police chief Supt Sik Choon Foo. Read full story",https://www.thestar.com.my/news/nation/2025/12/03/underground-water-flow-caused-jalan-gua-musang-lojing-landslide-says-police,https://apicms.thestar.com.my/uploads/images/2025/12/03/3653533.JPG,,"GUA MUSANG: The landslide at Jalan Gua Musang-Lojing FT185, Section 107.6 at Pos Blau here early Wednesday (Dec 3) is believed to have been caused by underground water flow, said district police chie… [+685 chars]",,"Laut Polizei verursachte unterirdischer Wasserfluss einen Erdrutsch in der Jalan Gua Musang-Lojing. GUA MUSANG: Es wird angenommen, dass der Erdrutsch an der Jalan Gua Musang-Lojing FT185, Abschnitt 107.6 bei Pos Blau hier am frühen Mittwoch (3. Dezember) durch unterirdischen Wasserfluss verursacht wurde, sagte der Bezirkspolizeichef Supt Sik Choon Foo. Lesen Sie die ganze Geschichte","Underground water flow caused Jalan Gua Musang-Lojing landslide, says police. GUA MUSANG: The landslide at Jalan Gua Musang-Lojing FT185, Section 107.6 at Pos Blau here early Wednesday (Dec 3) is believed to have been caused by underground water flow, said district police chief Supt Sik Choon Foo. Read full story","Sub aqua profluens Jalan Gua Musang-Lojing terram terrae effecit, dicit magistratus. GUA MUSANG: Lapsus in Jalan Gua Musang-Lojing FT185, Sectio 107.6 apud Pos Blau hic mane Mercurii (Dec. 3) creditur causatus ab aqua subterraneo fluxus, qui praefectus vigilum regionis Supt Sik Choon Foo dicitur. Read full story",2025-12-06 10:19:10+00:00
