index,published,keyword,domain,language,valid,title,description,url,image,archive,content,quote
14b942d5bd38425a21ba10ddc15f2309,2025-10-31T08:05:20Z,'landslide',nep123.com,en,0,Dharan-Dhankuta Road Partially Collapses,"Dharan-Dhankuta Road Partially Closed Due to Landslide: Travel Advisory The Dharan-Dhankuta road is currently experiencing significant travel disruptions due to a landslide. As of this morning at 11 AM, approximately 10 meters of the road in Sangurigadhi Rura…",https://nep123.com/dharan-dhankuta-road-partially-collapses/,https://nep123.com/wp-content/uploads/2025/09/basantapur_featured.jpg,,"Dharan-Dhankuta Road Partially Closed Due to Landslide: Travel Advisory
The Dharan-Dhankuta road is currently experiencing significant travel disruptions due to a landslide. As of this morning at 11… [+953 chars]",
b35c7b8deb77e6f647846ab33b370755,2025-10-31T10:15:00Z,'landslide road',www.thestar.com.my,en,0,Jalan Tun Sardon to reopen at 8pm tonight (Oct 31),GEORGE TOWN: Jalan P14 Jalan Tun Sardon near here will reopen to traffic at 8pm on Friday (Oct 31) after the route was closed due to a landslide. Read full story,https://www.thestar.com.my/news/nation/2025/10/31/jalan-tun-sardon-to-reopen-at-8pm-tonight-oct-31,https://apicms.thestar.com.my/uploads/images/2025/10/31/3599619.jpg,,"GEORGE TOWN: Jalan Tun Sardon near here will reopen to traffic at 8pm on Friday (Oct 31) after the route was closed due to a landslide.
Penang infrastructure, transport and digital committee chairma… [+666 chars]",
7e33f5d07f8edcf801ae9de4bc05206e,2025-10-31T11:25:20Z,'landslide rain',indianexpress.com,en,0,"Flash flood and landslide risks high: Cyclone after-effect drenches North Bengal, with red alert for three districts","Thunderstorms with gusty wind and lightning will accompany rain across all of North Bengal’s districts on Friday, the IMD said",https://indianexpress.com/article/cities/kolkata/flash-flood-and-landslide-risks-high-in-north-bengal-10338067/,https://images.indianexpress.com/2025/10/norrth.png,,"The India Meteorological Department (IMD) has issued a severe weather alert for North Bengal, warning of extremely heavy rainfall on Friday, October 31.“The system (Cyclone Montha) is currently posit… [+2148 chars]",
1c319af2c6b51b783b52a3c4b47f7b74,2025-10-31T12:45:04Z,'landslide',abcnews.go.com,en,0,Floods kill 13 in Central Vietnam as rescue operations push forward,Rescue operations have intensified across central Vietnam as floodwaters recede after days of record rain and deadly landslides that left at least 13 people dead and 11 missing,https://abcnews.go.com/International/wireStory/floods-kill-13-central-vietnam-rescue-operations-push-127052301,https://i.abcnewsfe.com/a/42b1798f-6d71-47f8-9528-4d03f0ca5191/wirestory_41ea9fdfe6121d1dff276a586f7ffb50_16x9.jpg?w=1600,,"HANOI, Vietnam -- Rescue operations intensified Friday across central Vietnam as floodwaters receded after days of record rain and deadly landslides that left at least 13 people dead, 11 missing and … [+2594 chars]",
