index,published,keyword,domain,language,valid,title,description,url,image,archive,content,quote,de,en,la,added
a27f857e8348047797ad309b465cbf73,2026-01-22T06:13:56Z,'landslide rain',japantoday.com,en,0.9,Rescuers search for survivors after landslide at New Zealand campsite,"Rescue workers in New Zealand searched on Thursday for several people missing, including children, following a landslide at a campsite as heavy rains ‌caused widespread damage and left thousands without power. Homes were evacuated and roads closed as the heav…",https://japantoday.com/category/world/rescuers-search-for-survivors-after-landslide-at-new-zealand-campsite1,,http://web.archive.org/web/20260122075205/https://japantoday.com/category/world/rescuers-search-for-survivors-after-landslide-at-new-zealand-campsite1,"Rescue workers in New Zealand searched on Thursday for several people missing, including children, following a landslide at a campsite as heavy rains caused widespread damage and left thousands witho… [+2699 chars]",,"Retter suchen nach Erdrutsch auf neuseeländischem Campingplatz nach Überlebenden. Rettungskräfte in Neuseeland suchten am Donnerstag nach mehreren Vermissten, darunter Kindern, nachdem es auf einem Campingplatz zu einem Erdrutsch gekommen war, als heftige Regenfälle große Schäden anrichteten und Tausende ohne Strom ließen. Häuser wurden evakuiert und Straßen gesperrt, da die Schwere…","Rescuers search for survivors after landslide at New Zealand campsite. Rescue workers in New Zealand searched on Thursday for several people missing, including children, following a landslide at a campsite as heavy rains ‌caused widespread damage and left thousands without power. Homes were evacuated and roads closed as the heav…","Rescuers quaerere residuos postquam landa in Nova Zelandia campsite. Opifices in Nova Zelandia liberate quaesiverunt die Iovis aliquot homines absentes, etiam infantes, sequentes in campo in campis sicut imbribus graves multa damna causaverunt et milia sine potentia reliquerunt. Domos emittitur et viae clausae sicut coelum...",2026-01-24 01:29:07+00:00
7597ef3e9bc222b400402f1c24d5388e,2026-01-22T19:11:38Z,'landslide',www.abc.net.au,en,0.9,Search continues for people buried under New Zealand landslide,Specialist officers have worked through the night with earthmoving equipment to try and find those trapped under the rubble at a popular tourist spot on New Zealand's North Island.,https://www.abc.net.au/news/2026-01-23/new-zealand-landslide-search-at-mount-maunganui-continues/106259556,https://live-production.wcms.abc-cdn.net.au/4191ca605d59d32d78864b5e8fb99284?impolicy=wcms_watermark_news&cropH=2250&cropW=4000&xPos=0&yPos=320&width=862&height=485&imformat=generic,http://web.archive.org/web/20260122203944/https://www.abc.net.au/news/2026-01-23/new-zealand-landslide-search-at-mount-maunganui-continues/106259556,"Emergency services have worked through the night searching for people, including children, who are trapped under the rubble of a landslide in New Zealand.
Homes were evacuated and roads closed as th… [+3325 chars]",,"Die Suche nach Menschen, die unter einem Erdrutsch in Neuseeland begraben wurden, geht weiter. Spezialbeamte haben die ganze Nacht mit Erdbewegungsgeräten gearbeitet, um zu versuchen, die unter den Trümmern Verschütteten an einem beliebten Touristenort auf der Nordinsel Neuseelands zu finden.",Search continues for people buried under New Zealand landslide. Specialist officers have worked through the night with earthmoving equipment to try and find those trapped under the rubble at a popular tourist spot on New Zealand's North Island.,Quaerere pergit hominibus sub Nova Zelandia subterraneis sepultis. Ministri operarii per noctem cum apparatu terreo moventis laboraverunt ad tentandum et captiosos inveniendos sub ruderibus ad maculam popularem urbis in Nova Zelandia Septentrionalis Islandiae.,2026-01-24 01:29:07+00:00
7196c4afbec79608ee6fb7bee0c7bb48,2026-01-23T00:00:00Z,'landslide',www.nature.com,en,0.9,Earthquakes act as a capacitor for terrestrial organic carbon,"Using the 2008 Wenchuan Earthquake, the authors show that earthquake-triggered landslides increased mountain carbon storage by ~10% from 2008 to 2020, as vegetation recovery and sediment burial retained carbon, revealing earthquakes and landslides function as…",https://www.nature.com/articles/s41467-026-68341-3,,,"<li>Chen, H., Wu, N., Yuan, X., Gao, Y. &amp; Zhu, D. Aftermath of the Wenchuan earthquake. Front. Ecol. Environ.7, 72 (2009).
Google Scholar 
</li><li>Stone, R. Wenchuan earthqukea deeply scarred … [+12015 chars]",,"Erdbeben wirken als Kondensator für terrestrischen organischen Kohlenstoff. Anhand des Wenchuan-Erdbebens 2008 zeigen die Autoren, dass durch Erdbeben ausgelöste Erdrutsche die Kohlenstoffspeicherung in den Bergen von 2008 bis 2020 um etwa 10 % erhöhten, da die Erholung der Vegetation und die Sedimentverlagerung Kohlenstoff zurückhielten, was zeigt, dass Erdbeben und Erdrutsche als… wirken.","Earthquakes act as a capacitor for terrestrial organic carbon. Using the 2008 Wenchuan Earthquake, the authors show that earthquake-triggered landslides increased mountain carbon storage by ~10% from 2008 to 2020, as vegetation recovery and sediment burial retained carbon, revealing earthquakes and landslides function as…","Terrae motus ut capacitor carbonis organici terrestris agunt. Wenchuan Terrae motu MMVIII utentes, auctores ostendunt terrae motus iactati proruere auctos repositionis montis carbonii ab ~10% ab 2008 ad 2020, ut vegetationem recuperare et sedimentum sepulturae carbonis retentae, terrae motus et ruinas quasi ... functionem ostendentes.",2026-01-24 01:29:07+00:00
da2d43159b25b412de583c38ed1a469e,2026-01-23T15:00:00Z,'rock fall',comicbook.com,en,0.7,The Rock’s Critically Acclaimed Box Office Bomb Just Hit Streaming,"Dwayne “The Rock” Johnson is no stranger to the movies. Since his first film, 2001’s The Mummy Returns, the WWE star has established a successful acting career, becoming one of the highest-paid and highest-grossing actors of all time. Last fall, Johnson debut…",http://comicbook.com/movies/news/the-rocks-critically-acclaimed-box-office-bomb-just-hit-streaming/,"https://comicbook.com/wp-content/uploads/sites/4/2025/10/The-Rock-Smashing-Machine.jpg?resize=2000,1125",http://web.archive.org/web/20260123175911/https://comicbook.com/movies/news/the-rocks-critically-acclaimed-box-office-bomb-just-hit-streaming/,"Dwayne The Rock Johnson is no stranger to the movies. Since his first film, 2001s The Mummy Returns, the WWE star has established a successful acting career, becoming one of the highest-paid and high… [+2344 chars]",,"Die von der Kritik gefeierte Kassenbombe von The Rock ist gerade im Stream angekommen. Dwayne „The Rock“ Johnson ist kein Unbekannter im Kino. Seit seinem ersten Film, „The Mummy Returns“ aus dem Jahr 2001, hat der WWE-Star eine erfolgreiche Schauspielkarriere aufgebaut und ist zu einem der bestbezahlten und umsatzstärksten Schauspieler aller Zeiten geworden. Letzten Herbst debütierte Johnson…","The Rock’s Critically Acclaimed Box Office Bomb Just Hit Streaming. Dwayne “The Rock” Johnson is no stranger to the movies. Since his first film, 2001’s The Mummy Returns, the WWE star has established a successful acting career, becoming one of the highest-paid and highest-grossing actors of all time. Last fall, Johnson debut…","Critice acclamatum est Box Office Bomb Just Hit Streaming. Dwayne “Petra” Johnson non est alienus a pelliculis. Cum primum cinematographicum, 2001's The Mummy Returns, WWE stellam prospere agens curriculum constituit, unus e summis-solutis et grossis actoribus omnium temporum factus est. Novissima ruina, Johnson debut…",2026-01-25 05:27:46+00:00
e2b74b0422f4fc04dc1eb81c51215eb5,2026-01-22T19:31:58Z,'rock fall',www.the-independent.com,en,0.8,Alex Honnold explains what would happen if he falls during live free solo of Taiwan skyscraper on Netflix,Professional rock climber will scale one of the world’s tallest skyscrapers live on Netflix,https://www.the-independent.com/arts-entertainment/tv/news/alex-honnold-free-solo-netflix-b2905851.html,"https://static.the-independent.com/2026/01/22/17/11/Alex-Honnold.jpeg?trim=0,0,0,0&width=1200&height=800&crop=1200:800",http://web.archive.org/web/20260122205430/https://www.the-independent.com/arts-entertainment/tv/news/alex-honnold-free-solo-netflix-b2905851.html,"Your support helps us to tell the story
From reproductive rights to climate change to Big Tech, The Independent is on the ground when the story is developing. Whether it's investigating the financia… [+3746 chars]",,"Alex Honnold erklärt, was passieren würde, wenn er während eines Live-Free-Solo eines taiwanesischen Wolkenkratzers auf Netflix stürzt. Ein professioneller Kletterer wird live auf Netflix einen der höchsten Wolkenkratzer der Welt erklimmen",Alex Honnold explains what would happen if he falls during live free solo of Taiwan skyscraper on Netflix. Professional rock climber will scale one of the world’s tallest skyscrapers live on Netflix,Alex Honnold declarat quid futurum sit si in vivo libero solo de Taiwan skyscraper in Netflix cadit. Professional petram exhibuit in unum mundi longissimi caeli rasorium vive in Netflix,2026-01-25 05:27:46+00:00
f31c5bacc2e942a4a4cae184d58726c5,2026-01-21T21:14:06Z,'landslide',www.nzherald.co.nz,en,0.9,Ōmokoroa Harbour View Rd landslide forces early morning evacuations,Four residents were evacuated from Harbour View Rd at 4.30am.,https://www.nzherald.co.nz/bay-of-plenty-times/news/omokoroa-harbour-view-rd-landslide-forces-early-morning-evacuations/ATTVTJW6VBEF5FLMHJ2TGUSUAY/,https://www.nzherald.co.nz/resizer/v2/FMSVVYBUPJBK3HQE67B5Y2AXTA.jpg?auth=274aa7cce14b0e8060d4510acafe3e8c5c787699951be3ea75605c3b90b33e18&width=1200&height=675&quality=70&focal=989%2C389&smart=false,http://web.archive.org/web/20260122072948/https://www.nzherald.co.nz/bay-of-plenty-times/news/omokoroa-harbour-view-rd-landslide-forces-early-morning-evacuations/ATTVTJW6VBEF5FLMHJ2TGUSUAY/,"An elderly couple were evacuated from the home where the slip came down next door and two other neighbours were evacuated too.
 The reporter, who was speaking with other neighbours at the scene, sai… [+2356 chars]",,Erdrutsch in der Ōmokoroa Harbour View Road erzwingt Evakuierungen am frühen Morgen. Vier Bewohner wurden um 4.30 Uhr aus der Harbour View Road evakuiert.,Ōmokoroa Harbour View Rd landslide forces early morning evacuations. Four residents were evacuated from Harbour View Rd at 4.30am.,Ōmokoroa Harbour View Rd landslide copias primo mane evacuationes. Quattuor incolas ex Harbour View Rd ad 4.30am excesserunt.,2026-01-25 10:21:09+00:00
bde64f27acfc31e35c1a28146c5c7ecf,2026-01-22T00:35:59Z,'landslide',www.nzherald.co.nz,en,0.9,Pāpāmoa family evacuate after landslide hits neighbouring homes,'I was climbing through the mud about up to my thighs.',https://www.nzherald.co.nz/bay-of-plenty-times/news/papamoa-family-evacuate-after-landslide-hits-neighbouring-homes/Q3MSETCPYNGJ7EJ2W2TCASJMLY/,https://www.nzherald.co.nz/resizer/v2/3AFEONW4FNDAPOSQ5ZQBES7XNY.jpg?auth=0f778f445326175508797b03cc2fce7eddf0416b6720a8529d7c6d6f4fa55a34&width=1200&height=675&quality=70&smart=true,http://web.archive.org/web/20260122190938/https://www.nzherald.co.nz/bay-of-plenty-times/news/papamoa-family-evacuate-after-landslide-hits-neighbouring-homes/Q3MSETCPYNGJ7EJ2W2TCASJMLY/,"Slips also hit houses in mokoroa and Bellevue.
Police have said two people are unaccounted from the Welcome Bay Rd slip and another person had been seriously injured.
They were notified at 4.15am t… [+3670 chars]",,"Familie Pāpāmoa wird evakuiert, nachdem benachbarte Häuser von einem Erdrutsch getroffen wurden. „Ich bin bis zu den Oberschenkeln durch den Schlamm geklettert.“",Pāpāmoa family evacuate after landslide hits neighbouring homes. 'I was climbing through the mud about up to my thighs.',Pāpāmoa familia cedentem post lāpsam vicinas domos pervenit. 'Per lutum ascendi usque ad femora.',2026-01-25 10:21:09+00:00
3881993ebe363465e266d28179d30385,2026-01-22T14:06:00Z,'landslide',www.newser.com,en,0.9,"Landslides Slam Into New Zealand House, Campground","Landslides hit a house and a campground in New Zealand on Thursday, leaving at least two dead while emergency crews tried to rescue others buried in the rubble, officials said. The first landslide hit a house in the community of Welcome Bay, on New Zealand's …",https://www.newser.com/story/382392/landslides-slam-into-new-zealand-house-campground.html,https://img2-azrcdn.newser.com/image/1660043-12-20260122081648.jpeg,http://web.archive.org/web/20260122160749/https://www.newser.com/story/382392/landslides-slam-into-new-zealand-house-campground.html,"Landslides hit a house and a campground in New Zealand on Thursday, leaving at least two dead while emergency crews tried to rescue others buried in the rubble, officials said. The first landslide hi… [+2171 chars]",,"Erdrutsche erschüttern Haus und Campingplatz in Neuseeland. Am Donnerstag erschütterten Erdrutsche ein Haus und einen Campingplatz in Neuseeland und forderten mindestens zwei Tote, während Rettungskräfte versuchten, weitere in den Trümmern Verschüttete zu retten, sagten Beamte. Der erste Erdrutsch erschütterte ein Haus in der Gemeinde Welcome Bay an Neuseelands …","Landslides Slam Into New Zealand House, Campground. Landslides hit a house and a campground in New Zealand on Thursday, leaving at least two dead while emergency crews tried to rescue others buried in the rubble, officials said. The first landslide hit a house in the community of Welcome Bay, on New Zealand's …","Proruit Slam in Novam Zelandiam Domum, Campground. Prolapsus domum et campground in Nova Zelandia die Iovis percussit, relinquens saltem duos mortuos dum nautae tumultuarii alios in ruderibus sepultos eripere conati sunt, ministri dixerunt. Prima lapsus domum in conventu Welcomeae Bay, in Nova Zelandia ... percussit.",2026-01-25 10:21:09+00:00
603a11df84978102d5471822ea4c82b3,2026-01-23T06:09:00Z,'landslide',www.nzherald.co.nz,en,0.9,Mount Maunganui campground landslide: Search for six missing continues in Tauranga,Families held a dawn karakia as crews continued recovery efforts into day two.,https://www.nzherald.co.nz/bay-of-plenty-times/news/mount-maunganui-campground-landslide-search-for-six-missing-continues-in-tauranga/JMP2Y7DM4RA3XIBPYG3HFZUOGY/,https://www.nzherald.co.nz/resizer/v2/KAOSGMWUQZDF3HRHFQOMPYWJD4.jpg?auth=8708f5418009fa1ed6e446911a683b0778980ed7345b185f7b865eab9968777c&width=1200&height=675&quality=70&focal=2429%2C1193&smart=false,http://web.archive.org/web/20260123194919/https://www.nzherald.co.nz/bay-of-plenty-times/news/mount-maunganui-campground-landslide-search-for-six-missing-continues-in-tauranga/JMP2Y7DM4RA3XIBPYG3HFZUOGY/,"Prime Minister Christopher Luxon called the big landslide at the Mount Maunganui Beachside Holiday Park an absolute tragedy and said he had met with many of the family members of the missing. 
He sa… [+6611 chars]",,"Erdrutsch auf dem Campingplatz Mount Maunganui: Die Suche nach sechs Vermissten geht in Tauranga weiter. Die Familien veranstalteten im Morgengrauen eine Karakia, während die Besatzungen ihre Bergungsbemühungen bis zum zweiten Tag fortsetzten.",Mount Maunganui campground landslide: Search for six missing continues in Tauranga. Families held a dawn karakia as crews continued recovery efforts into day two.,Mons Maunganui campground terret: Quaero sex absentes continuat in Tauranga. Familiae karakia auroram tenuerunt sicut conatus nautae continuae recuperationis in duos dies.,2026-01-25 10:21:09+00:00
8cf2efb9cd6ce019b114e4ea3a1fc56a,2026-01-23T16:44:54Z,'landslide road',en.antaranews.com,en,0.9,Government accelerates repairs on landslide-hit trans-Sumatra road,"The Ministry of Public Works, in cooperation with state-run construction company Hutama Karya, is accelerating repairs on sections of the Trans-Sumatra Road ...",https://en.antaranews.com/news/401386/government-accelerates-repairs-on-landslide-hit-trans-sumatra-road,https://cdn.antaranews.com/cache/1200x800/2026/01/23/IMG_4702.jpeg,http://web.archive.org/web/20260123203457/https://en.antaranews.com/news/401386/government-accelerates-repairs-on-landslide-hit-trans-sumatra-road,"Jakarta (ANTARA) - The Ministry of Public Works, in cooperation with state-run construction company Hutama Karya, is accelerating repairs on sections of the Trans-Sumatra Road that collapsed due to l… [+2387 chars]",,Regierung beschleunigt Reparaturen an der von einem Erdrutsch betroffenen Trans-Sumatra-Straße. Das Ministerium für öffentliche Arbeiten beschleunigt in Zusammenarbeit mit dem staatlichen Bauunternehmen Hutama Karya die Reparaturen an Abschnitten der Trans-Sumatra-Straße ...,"Government accelerates repairs on landslide-hit trans-Sumatra road. The Ministry of Public Works, in cooperation with state-run construction company Hutama Karya, is accelerating repairs on sections of the Trans-Sumatra Road ...","Imperium accelerat reparationes in via LAPSUS trans-Sumatra. Ministerium operum publicorum, cooperante societate constructionis societatis Hutama Karya status-currunt, accelerat reparationes in sectionibus Via Trans-Sumatra ...",2026-01-25 10:21:09+00:00
6893c12addcf16ff808178971a4fb9a9,2026-01-24T09:04:06Z,'landslide rain',en.antaranews.com,en,0.9,Search ongoing for over 80 missing in West Bandung landslide,A search and rescue (SAR) operation is ongoing to rescue over 80 residents who went missing following a heavy rain-induced landslide on the slope of Mount ...,https://en.antaranews.com/news/401434/search-ongoing-for-over-80-missing-in-west-bandung-landslide,https://cdn.antaranews.com/cache/1200x800/2026/01/24/f3922de0-ea10-4cc5-b0d9-556f06a54b93.jpeg,,"West Bandung, West Java (ANTARA) - A search and rescue (SAR) operation is ongoing to rescue over 80 residents who went missing following a heavy rain-induced landslide on the slope of Mount Burangran… [+1956 chars]",,"Suche nach über 80 Vermissten bei Erdrutsch in West-Bandung läuft. Derzeit läuft eine Such- und Rettungsaktion (SAR) zur Rettung von über 80 Bewohnern, die nach einem durch starken Regen verursachten Erdrutsch am Hang des Mount ... vermisst wurden.",Search ongoing for over 80 missing in West Bandung landslide. A search and rescue (SAR) operation is ongoing to rescue over 80 residents who went missing following a heavy rain-induced landslide on the slope of Mount ...,Quaero perennem per 80 absentis in West Bandung landslide. Investigatio et liberatio (SAR) operatio continuata est ut subveniat super 80 incolas qui absentes sequuntur sequentes pluviae graves in declivi montis inducta ...,2026-01-25 10:21:09+00:00
4617c78b4d3f845b70105a7ff6840899,2026-01-19T15:40:38Z,'landslide',english.gossiplankanews.com,en,0.9,A one-ton blue gemstone at the foot of Naye Giya Galaha mountain - investigations begin amidst police protection.,"A large blue rock has emerged from a landslide near the Sri Muththumari Amman Kovil in the Galaha, Gallanthenna area of Kandy. The Galaha Police state that steps have been taken to deploy special police security to the site due to suspicions that it might be …",https://english.gossiplankanews.com/2026/01/a-one-ton-blue-gemstone-at-foot-of-naye.html,https://lh3.googleusercontent.com/blogger_img_proxy/AEn0k_vvJmxliSh70gM2Ge0w7g-nKRa7HTy2TwC2KJfejbAU73MldWeSDgmty9RAKTmB_DVcqdpidGINg7D1IkiyIRQcFxjvlVT4mMmrjVZX-1o3mt4QEn0fak7Zr0-hYp8xztdz4qRf0xGbDX3QNWpBGu94mYEKXXHsCyA5KG4=w1600,,"A large blue rock has emerged from a landslide near the Sri Muththumari Amman Kovil in the Galaha, Gallanthenna area of Kandy. The Galaha Police state that steps have been taken to deploy special pol… [+991 chars]",,"Ein eine Tonne schwerer blauer Edelstein am Fuße des Berges Naye Giya Galaha – die Ermittlungen beginnen unter Polizeischutz. Ein großer blauer Stein ist aus einem Erdrutsch in der Nähe des Sri Muththumari Amman Kovil im Gebiet Galaha, Gallanthenna in Kandy entstanden. Die Polizei von Galaha gibt an, dass Schritte unternommen wurden, um vor Ort besondere Sicherheitsmaßnahmen der Polizei einzusetzen, da der Verdacht besteht, dass …","A one-ton blue gemstone at the foot of Naye Giya Galaha mountain - investigations begin amidst police protection.. A large blue rock has emerged from a landslide near the Sri Muththumari Amman Kovil in the Galaha, Gallanthenna area of Kandy. The Galaha Police state that steps have been taken to deploy special police security to the site due to suspicions that it might be …","Lapis unus-tonus caeruleus ad radices montis Naye Giya Galaha - investigationes inter tutelam vigilum incipiunt.. Saxa magna caerulea ex prolapsione Sri Muththumari prope Amman Kovil in Galaha, Gallanthenna Kandy area emersit. In Galaha Police status gradus sumti sunt ad explicandam specialem securitatem vigilum ad situm propter suspiciones ut ... esset.",2026-01-25 20:23:22+00:00
c29dd442cd75771212c485583df91b39,2026-01-24T10:08:00Z,'landslide rain',news.sky.com,en,0.9,Eight dead and more than 80 missing after Indonesia landslide,"Rescue efforts are under way on Java island following a landslide which was caused by days of torrential rainfall, authorities have said.",https://news.sky.com/story/eight-dead-and-dozens-missing-after-landslide-on-indonesias-java-island-13498297,https://e3.365dm.com/26/01/1600x900/skynews-extreme-weather-indonesia_7144134.jpg?20260124103310,,"At least eight people have been killed and more than 80 others are missing following a landslide on Indonesia's Java island. 
The landslide happened on Saturday in the West Bandung district of West … [+1783 chars]",,"Acht Tote und mehr als 80 Vermisste nach Erdrutsch in Indonesien. Nach Angaben der Behörden sind auf der Insel Java nach einem Erdrutsch, der durch tagelange sintflutartige Regenfälle verursacht wurde, Rettungsmaßnahmen im Gange.","Eight dead and more than 80 missing after Indonesia landslide. Rescue efforts are under way on Java island following a landslide which was caused by days of torrential rainfall, authorities have said.","Octo mortui et plus quam 80 defuit post Indonesiam LAPSUS. Eripe nisus sub itinere in insula Javae sequentes lapsus qui per dies pluviae torrentis causatur, auctores dixerunt.",2026-01-26 05:32:43+00:00
02f494e237fc67f84706745c0b0baf67,2026-01-24T10:44:02Z,'landslide',en.antaranews.com,en,0.9,Bad weather hampers search for 82 victims of West Bandung landslide,The West Java Regional Disaster Mitigation Agency (BPBD) informed that the unfavorable weather situation hampered the search for 82 residents buried by a ...,https://en.antaranews.com/news/401454/bad-weather-hampers-search-for-82-victims-of-west-bandung-landslide,https://cdn.antaranews.com/cache/1200x800/2026/01/24/IMG_0652.jpeg,,"Bandung, West Java (ANTARA) - The West Java Regional Disaster Mitigation Agency (BPBD) informed that the unfavorable weather situation hampered the search for 82 residents buried by a landslide in Pa… [+2119 chars]",,"Schlechtes Wetter erschwert die Suche nach 82 Opfern des Erdrutschs in West Bandung. Die West Java Regional Disaster Mitigation Agency (BPBD) teilte mit, dass die ungünstige Wetterlage die Suche nach 82 von einem ... begrabenen Bewohnern erschwert habe.",Bad weather hampers search for 82 victims of West Bandung landslide. The West Java Regional Disaster Mitigation Agency (BPBD) informed that the unfavorable weather situation hampered the search for 82 residents buried by a ...,Tempestas impedit quaeramus 82 victimas West Bandung in ruina. Occidens Java Regionalis Calamitas Mitigationis Agency (BPBD) certior factus est condicionem tempestatum adversam inpeditum inquisitionis 82 incolarum ab a ... sepultum esse.,2026-01-26 05:32:43+00:00
f38b4b56c46eb23669d5680aa35d8864,2026-01-24T13:22:18Z,'landslide',www.cbc.ca,en,0.9,Authorities working to identify victims of landslide that hit New Zealand campground,"Rescue efforts have ceased and a recovery operation ⁠is under way, police said, adding that it was unlikely any ‍of those missing are ⁠still alive.",https://www.cbc.ca/news/world/new-zealand-campground-landslide-victims-9.7059472,"https://i.cbc.ca/ais/dfb96fc5-dde0-4637-ae14-cb5271955d27,1769260887229/full/max/0/default.jpg?im=Crop%2Crect%3D%280%2C58%2C2553%2C1436%29%3BResize%3D620",,"New Zealand authorities said on Saturday they were working to identify victims of a landslide that hit a busy campground on the country's North Island, after human remains were found overnight.
Six … [+1876 chars]",,"Behörden arbeiten daran, Opfer eines Erdrutschs zu identifizieren, der einen neuseeländischen Campingplatz heimgesucht hat. Die Rettungsbemühungen seien eingestellt worden und eine Bergungsaktion sei im Gange, teilte die Polizei mit und fügte hinzu, dass es unwahrscheinlich sei, dass einer der Vermissten noch am Leben sei.","Authorities working to identify victims of landslide that hit New Zealand campground. Rescue efforts have ceased and a recovery operation ⁠is under way, police said, adding that it was unlikely any ‍of those missing are ⁠still alive.","Auctoritates operantur ad cognoscendas victimas de lapsu qui Novam Zelandiam campground feriunt. Liberare conatus cessaverunt et operatio recuperatio sub via est, dixit vigil, addens inconveniens quodlibet eorum absentium adhuc vivere.",2026-01-26 05:32:43+00:00
