index,published,keyword,domain,language,valid,title,description,url,image,archive,content,quote
b8c67145072d672cccd99854a3022279,2025-10-17T07:04:32Z,'landslide death',www.yahoo.com,en,0.1,Ivory Coast's Ouattara looks to ride economic boom to fourth term,By Robbie Corey-Boulet ABIDJAN (Reuters) -Alassane Ouattara's long path to becoming Ivory Coast president included two elections in which he was disqualified...,https://www.yahoo.com/news/articles/ivory-coasts-ouattara-looks-ride-070432261.html,https://media.zenfs.com/en/reuters.com/2cb4ddb50a137e4c656ec3993a6d963b,,"By Robbie Corey-Boulet
ABIDJAN (Reuters) -Alassane Ouattara's long path to becoming Ivory Coast president included two elections in which he was disqualified from running and a brief but brutal 2010… [+4362 chars]",
ecdbdeea5ed85f6cdb61810b88785d50,2025-10-17T14:00:00Z,'landslide protection',journals.plos.org,en,0.1,Spatial factors affecting young females’ disaster exposure in municipalities facing population decline,"Understanding and reducing the risk of natural disasters is crucial for maintaining the economy and society. Since Japan is a disaster-prone country and the most advanced nation in the world regarding aging and population decline, it necessitates a natural di…",https://journals.plos.org/plosone/article?id=10.1371/journal.pone.0334706,https://journals.plos.org/plosone/article/figure/image?id=10.1371/journal.pone.0334706.g014&size=inline,,"Abstract
Understanding and reducing the risk of natural disasters is crucial for maintaining the economy and society. Since Japan is a disaster-prone country and the most advanced nation in the worl… [+64203 chars]",
7414b1d1d9f81ec78ac2bf741becbec9,2025-10-17T15:05:00Z,'rock fall',www.cbsnews.com,en,0.0,"Ace Frehley, Kiss' original lead guitarist, dies","Ace Frehley, the longtime lead guitarist of the rock band Kiss, died Thursday after a recent fall at his home. He was 74 years old. CBS News' Vlad Duthiers looks back at his legacy.",https://www.cbsnews.com/video/ace-frehley-kiss-original-lead-guitarist-dies/,https://assets2.cbsnewsstatic.com/hub/i/r/2025/10/17/4426febb-1602-4edd-9c8d-471907558ffc/thumbnail/1200x630/edefabc410894c868207e9e21e2d3e98/1017-cmo-duthiers.jpg,,Copyright ©2025 CBS Interactive Inc. All rights reserved.,
333a8f7b65b3b847e10108965096b40b,2025-10-19T11:23:02Z,'landslide protection',www.commondreams.org,en,0.1,Dispatches From the Winter of Our Discontent Against Woodside Energy's Carbon Bomb,"“This year was a year of change, a year when secret fears come into the open, when discontent stops being dormant and changes gradually to anger. It wasn’t only in me… And it wasn’t only in the nation; the whole world stirred with restlessness and uneasiness …",https://www.commondreams.org/opinion/australia-fossil-fuel,https://www.commondreams.org/media-library/image.jpg?id=61775013&width=1200&height=600&coordinates=0%2C85%2C0%2C86,,"This year was a year of change, a year when secret fears come into the open, when discontent stops being dormant and changes gradually to anger. It wasnt only in me And it wasnt only in the nation; t… [+9090 chars]",
990978cff455cb57b0c35f5d308f7ea1,2025-10-21T12:42:52Z,'landslide death',www.hurriyetdailynews.com,en,0.1,MHP leader calls on Turkish Cyprus to join Türkiye,"Nationalist Movement Party (MHP) leader Devlet Bahçeli has dismissed the recent presidential election in Turkish Cyprus, urging authorities to consider formally joining Türkiye.",https://www.hurriyetdailynews.com/mhp-leader-calls-on-turkish-cyprus-to-join-turkiye-214884,https://image.hurimg.com/i/hurriyet/75/200x200/68f77fcb01497dfe3a2a1cd4.jpg,,"ANKARA
Nationalist Movement Party (MHP) leader Devlet Bahçeli has dismissed the recent presidential election in Turkish Cyprus, urging authorities to consider formally joining Türkiye.
""After 81 Dü… [+1536 chars]",
baad2a46dc331e1af84572d4495463c0,2025-10-21T14:00:00Z,'landslide protection',journals.plos.org,en,0.1,Optimizing network bandwidth slicing identification: NADAM-enhanced CNN and VAE data preprocessing for enhanced interpretability,"Communication networks of the future will rely heavily on network slicing (NS), a technology that enables the creation of distinct virtual networks within a shared physical infrastructure. This capability is critical for meeting the diverse quality of service…",https://journals.plos.org/plosone/article?id=10.1371/journal.pone.0333286,https://journals.plos.org/plosone/article/figure/image?id=10.1371/journal.pone.0333286.g025&size=inline,,"Abstract
Communication networks of the future will rely heavily on network slicing (NS), a technology that enables the creation of distinct virtual networks within a shared physical infrastructure. … [+75575 chars]",
481781ebf6a95e5eed7b312d23089131,2025-10-21T23:03:11Z,'landslide',www.cbc.ca,en,0.0,B.C. has seen a lake tsunami before — and it could happen again,"In 2007, a massive landslide crashed into B.C.'s Lake Chehalis, triggering a tsunami that surged 38 metres up the shore — one of the most dramatic inland waves ever recorded. CBC’s Johanna Wagstaffe looks into how scientists were able to reconstruct the event…",https://www.cbc.ca/news/canada/british-columbia/bc-lake-tsunami-9.6947750,"https://i.cbc.ca/ais/3d447c28-503e-4e88-9e93-82f1918a0d95,1761080726697/full/max/0/default.jpg?im=Crop%2Crect%3D%280%2C378%2C4032%2C2268%29%3BResize%3D620",,"You've heard of a tsunami, a series of waves caused in a body of water by the displacement of that water. Warnings about tsunamis are often issued for communities near the ocean following powerful ea… [+693 chars]",
01bc10c4fbc890ff13340851d4f8c6be,2025-10-22T08:59:22Z,'landslide death',lithub.com,en,0.1,Cursed Mountains and Deathly Lakes: When Nature Is Explained By Myth,"The drive to explain perplexing things in nature, and the desire to understand earthshaking events of unfathomable scale are timeless human impulses. Found in cultures around the world, geomyths attempt to account for anomalous natural phenomena and massive g…",https://lithub.com/cursed-mountains-and-deathly-lakes-when-nature-is-explained-by-myth/,https://s26162.pcdn.co/wp-content/uploads/2025/10/accursed-mountains.jpg,,"The drive to explain perplexing things in nature, and the desire to understand earthshaking events of unfathomable scale are timeless human impulses. Found in cultures around the world, geomyths atte… [+20283 chars]",
99690e85ad2def917888e0f363f44360,2025-10-22T18:00:00Z,'landslide protection',www.newscientist.com,en,0.1,Must-watch documentary shows how Bush Senior failed the climate,"The White House Effect is a distressing look back at how President George H. W. Bush came to abandon his climate ambitions. It is essential viewing and a glimpse at a world that could have been, says Bethan Ackerley",https://www.newscientist.com/article/mg26835660-600-must-watch-documentary-shows-how-bush-senior-failed-the-climate/,https://images.newscientist.com/wp-content/uploads/2025/10/21114516/SEI_2702068831.jpg,,"President George H.W. Bush, left, with his pro-green advisor Bill Reilly
Netflix
The White House EffectDirected by Bonni Cohen, Pedro Kos and Jon Shenk, streaming on Netflix from 31 October
The op… [+4143 chars]",
dfd9530bea3805256f5ef37e408d5b62,2025-10-23T00:17:20Z,'landslide protection',kotaku.com,en,0.1,"This Ring Alarm for 3 Bedrooms Hits a New Record Low, Amazon Dumps Stock of Its Own Brand","This Ring Alarm kit provides complete wireless home security with two keypads, eight contact sensors, two motion detectors, and a base station for 2 to 4 bedroom homes.
The post This Ring Alarm for 3 Bedrooms Hits a New Record Low, Amazon Dumps Stock of Its O…",https://kotaku.com/this-ring-alarm-for-3-bedrooms-hits-a-new-record-low-amazon-dumps-stock-of-its-own-brand-2000638348,https://kotaku.com/app/uploads/2025/10/ring-alarm-14.jpg,,"Home security used to mean signing expensive contracts with professional monitoring companies, paying installation fees and dealing with clunky equipment bolted to your walls. Ring changed that equat… [+3133 chars]",
55d50c8c0bf849c14c64664eaca7d82d,2025-10-23T14:44:00Z,'landslide road',www.thestar.com.my,en,0.0,Dashcam footage of Penang landslide shows tonnes of earth narrowly missing vehicles,"GEORGE TOWN: Dashcam footage has emerged showing the moment the hillside gave way along Jalan Tun Sardon, sending tonnes of earth cascading onto the road and narrowly missing several vehicles. Read full story",https://www.thestar.com.my/news/nation/2025/10/23/dashcam-footage-of-penang-landslide-shows-tonnes-of-earth-narrowly-missing-vehicles,https://apicms.thestar.com.my/uploads/images/2025/10/23/3585127.jpg,,"GEORGE TOWN: Dashcam footage has emerged showing the moment the hillside gave way along Jalan Tun Sardon, sending tonnes of earth cascading onto the road and narrowly missing several vehicles.
Foota… [+2373 chars]",
c02db44a82e495790a4266ad78801ceb,2025-10-24T02:15:09Z,'landslide protection',english.khabarhub.com,en,0.1,Economic Digest: Nepal’s Business News in a Snap,"KATHMANDU: Economic Digest offers a concise yet comprehensive overview of significant business happenings in Nepal, presented in easily digestible summaries. Nepal’s economy and labor landscape are witnessing notable shifts shaped by both domestic development…",https://english.khabarhub.com/2025/24/502562/,https://english.khabarhub.com/wp-content/uploads/2024/05/Economic-Digest.jpg,,"KATHMANDU: Economic Digest offers a concise yet comprehensive overview of significant business happenings in Nepal, presented in easily digestible summaries.
Nepals economy and labor landscape are w… [+5620 chars]",
8d166c47e6dee5f916fae8b1789279eb,2025-10-24T07:00:00Z,'landslide',www.thestar.com.my,en,0.0,"Jln Tun Sardon landslide: Cleanup underway, technical probe to follow, says Zairil",Read full story,https://www.thestar.com.my/news/nation/2025/10/24/jln-tun-sardon-landslide-cleanup-underway-technical-probe-to-follow-says-zairil,https://apicms.thestar.com.my/uploads/images/2025/10/24/3586271.JPG,,"BALIK PULAU: A detailed technical investigation into the landslide incident along Jalan Tun Sardon (Bukit Baru) here will be carried out once cleanup works at the site have been completed, said Penan… [+2166 chars]",
13969ebe921a83a0bd1c548c511025b7,2025-10-25T00:43:56Z,'landslide protection',www.huffpost.com,en,0.1,Tropical Storm Melissa Stationary In The Caribbean As 4 Deaths Reported And Huge Rains Expected,"Tropical Storm Melissa is nearly stationary in the central Caribbean, with forecasters warning it could soon strengthen and brush past Jamaica as a powerful hurricane.",https://www.huffpost.com/entry/tropical-storm-melissa-caribbean_n_68fc1947e4b011e80886763e,https://img.huffingtonpost.com/asset/68fc1a8a180000e71afe43a6.jpg?ops=1200_630,,"SAN JUAN, Puerto Rico (AP) Tropical Storm Melissa was nearly stationary in the central Caribbean on Friday as forecasters warned it could strengthen and swipe Jamaica as a powerful hurricane and dump… [+6293 chars]",
fc3f81d44b0c9d723b2bd6adc09d9fe6,2025-10-25T06:03:00Z,'landslide',www.thestar.com.my,en,0.0,Jalan Tun Sardon to remain closed following six new landslides,BALIK PULAU: Jalan Tun Sardon (Bukit Baru) will be closed until further notice following six new landslides. Read full story,https://www.thestar.com.my/news/nation/2025/10/25/jalan-tun-sardon-to-remain-closed-following-six-new-landslides,https://apicms.thestar.com.my/uploads/images/2025/10/25/3587935.jpg,,"BALIK PULAU: Jalan Tun Sardon (Bukit Baru) will be closed until further notice following six new landslides.
State Infrastructure and transport committee chairman Zairil Khir Johari said initial pla… [+2174 chars]",
67414fc61d8d0959d191645584540182,2025-10-25T07:03:42Z,'landslide protection',www.aljazeera.com,en,0.1,"Tropical Storm Melissa, soon a hurricane, brings death, floods to Caribbean",Jamaica prepares for Melissa's arrival as forecasts predict over 72 hours of hurricane conditions and heavy rainfall.,https://www.aljazeera.com/news/2025/10/25/tropical-storm-melissa-soon-a-hurricane-brings-death-floods-to-caribbean,https://www.aljazeera.com/wp-content/uploads/2025/10/AP25298071082668-1761374873.jpg?resize=1920%2C1440,,"The slow-moving, but punishing, Tropical Storm Melissa that has already killed four people is threatening catastrophic flooding across the northern Caribbean as it strengthens towards Jamaica.
Melis… [+2515 chars]",
afc855c31c4553dc57b4684fad0c0758,2025-10-25T11:59:53Z,'landslide protection',www.irishtimes.com,en,0.1,This is a disastrous day for Fianna Fáil and Fine Gael,Huge number of spoiled votes does not convey a single message – bar one of hostility to established politics,https://www.irishtimes.com/politics/2025/10/25/this-is-a-disastrous-day-for-fianna-fail-and-fine-gael/,https://www.irishtimes.com/resizer/v2/BSSSGIX54FUJZFNOGBHLKOUIJE.jpg?smart=true&auth=52ab8e2c51cf85f21300b62f93513ae44c072cb8a5e379d298e1a2dd7939f6e7&width=1200&height=630,,"Not since the earthquake general election of 2011, when Fianna Fáil was almost made extinct in the wake of the financial crash and the IMF bailout, have Irish voters delivered such a stunning result … [+4345 chars]",
e598f1ef5676be346a45334e8f962c69,2025-10-25T14:31:31Z,'landslide protection',www.nbcnews.com,en,0.9,"Tropical Storm Melissa, forecast to become major hurricane, barrels toward Jamaica and Cuba","Tropical Storm Melissa is expected to intensify into a hurricane in the Caribbean on Saturday, bringing with it catastrophic flash flooding and potential landslides",https://www.nbcnews.com/weather/storms/tropical-storm-melissa-hurricane-updates-rcna239732,"https://media-cldnry.s-nbcnews.com/image/upload/t_nbcnews-fp-1200-630,f_auto,q_auto:best/rockcms/2025-10/251025-Tropical-Storm-Melissa-ch-0929-4faa60.jpg",,"Tropical Storm Melissa is expected to intensify into a hurricane in the Caribbean on Saturday, bringing with it catastrophic flash flooding and potential landslides.
The slow-moving storm is already… [+1514 chars]",
a1282a8f1f36ece4943539178b7bda1d,2025-10-25T14:46:40Z,'landslide protection',www.forbes.com,en,0.1,Kamala Harris Says She’d ‘Possibly’ Run For President Again: ‘I Am Not Done’,Harris made the comments in an interview with the BBC while stopping in London for her book tour.,https://www.forbes.com/sites/saradorn/2025/10/25/kamala-harris-says-shed-possibly-run-for-president-again-i-am-not-done/,https://imageio.forbes.com/specials-images/imageserve/68fce24e098416d032958c1b/0x0.jpg?format=jpg&height=900&width=1600&fit=bounds,http://web.archive.org/web/20251110081059/https://www.forbes.com/sites/saradorn/2025/10/25/kamala-harris-says-shed-possibly-run-for-president-again-i-am-not-done/,"Former Vice President Kamala Harris told the BBC she might run again for president, dismissing early odds that show shes a longshot for the Democratic nomination in 2028 and insisting she would conti… [+3131 chars]",
289f0630580920c733a7a64791b67a21,2025-10-25T18:53:17Z,'landslide',timesofindia.indiatimes.com,en,0.0,Minor landslide at Altinho worries Panaji residents,Panaji: The sudden heavy rain over the last few days caused a minor landslide near the old high court building at the foot of Altinho on Saturday. Loc.,https://timesofindia.indiatimes.com/city/goa/minor-landslide-at-altinho-worries-panaji-residents/articleshow/124816317.cms,"https://static.toiimg.com/thumb/msid-124816317,width-1070,height-580,imgsize-32136,resizemode-75,overlay-toi_sw,pt-32,y_pad-40/photo.jpg",,"Follow Us On Social Media
Copyright © 2025 Bennett, Coleman &amp; Co. Ltd. All rights reserved. For reprint rights: Times Syndication Service",
74f7e975bafb57865aa6fa33d032d52a,2025-10-27T02:33:07Z,'landslide',www.cnbc.com,en,0.0,Argentina's midterm election hands landslide win to Milei's libertarian overhaul,Early results in Argentina's legislative elections on Sunday showed a landslide victory for President Javier Milei.,https://www.cnbc.com/2025/10/27/argentinas-midterm-election-hands-landslide-win-to-mileis-libertarian-overhaul.html,https://image.cnbcfm.com/api/v1/image/108091223-1737638877407-gettyimages-2194781713-AFP_36VM727.jpeg?v=1738771625&w=1920&h=1080,,"Early results in Argentina's legislative elections on Sunday showed a landslide victory for President Javier Milei as voters overwhelmingly backed his free-market reforms and deep austerity measures,… [+2479 chars]",
b60970ad4a45e2f47af7154099ae06b2,2025-10-27T10:54:32Z,'rock fall',incrediblethings.com,en,0.0,5 Common Slope Stabilisation Methods to Know if You’re Building Near a Hill,"Australia is well-known for having rugged, diverse, and unstable landscapes. All of these factors can increase the risks of landslides, erosion, and rockfalls. Whether you’re planning to build a residential home or a commercial structure, it’s essential to kn…",https://incrediblethings.com/home/5-common-slope-stabilisation-methods-to-know-if-youre-building-near-a-hill/,https://incrediblethings.com/wp-content/uploads/2022/02/bigstock-Construction-Man-1450052.jpg,,"Australia is well-known for having rugged, diverse, and unstable landscapes. All of these factors can increase the risks of landslides, erosion, and rockfalls. Whether youre planning to build a resid… [+5373 chars]",
4dab3218a8f552c9f92b19709159b199,2025-10-28T09:10:27Z,'landslide',www.yahoo.com,en,0.0,Posts use AI video to exaggerate severity of Malaysia parking lot landslide,"After a mudslide damaged about a dozen parked vehicles near a hillside in Malaysia's northern Penang state on October 24, a dramatic video circulated in...",https://www.yahoo.com/news/articles/posts-ai-video-exaggerate-severity-091027510.html,https://s.yimg.com/ny/api/res/1.2/xC.5mrMfXrQ34MtrAnHpHA--/YXBwaWQ9aGlnaGxhbmRlcjt3PTEyMDA7aD02MDA7Y2Y9d2VicA--/https://media.zenfs.com/en/afp_factcheck_us_713/5f11a215cac8b0a0d8795cd1e37acc59,,"After a mudslide damaged about a dozen parked vehicles near a hillside in Malaysia's northern Penang state on October 24, a dramatic video circulated in social media posts falsely claiming it showed … [+2798 chars]",
3a454084e602aae151dfb634255b5ad3,2025-10-29T15:33:03Z,'landslide death',uk.news.yahoo.com,en,0.1,Hurricane Melissa leaves 25 dead in Haiti and causes damage in Jamaica and Cuba,"At least one death was reported in Jamaica, where Melissa roared ashore on Tuesday with top sustained winds of 185mph.",https://uk.news.yahoo.com/hurricane-melissa-leaves-25-dead-153303371.html,https://s.yimg.com/ny/api/res/1.2/n5u6v2AF3MnhAOwUuazq4A--/YXBwaWQ9aGlnaGxhbmRlcjt3PTEyMDA7aD02NzU7Y2Y9d2VicA--/https://media.zenfs.com/en/pa_viral_news_704/fb7510ceb489c57fe5058454ae3b7df5,,"Flooding from Hurricane Melissa has killed 25 people in Haiti while the storm still churned across Cuba on Wednesday after leaving Jamaica with widespread damage and power outages, officials said.
J… [+5505 chars]",
9b1d4ff0091acb772191ff837a977507,2025-10-29T17:26:46Z,'landslide death',www.abc.net.au,en,0.1,'That was hell': Hurricane Melissa leaves trail of devastation in Jamaica,"Authorities say 77 per cent of the country is without power after the category five ""storm of the century"" barrelled through on Tuesday.",https://www.abc.net.au/news/2025-10-30/hurricane-melissa-jamaica-clean-up-begins/105949964,https://live-production.wcms.abc-cdn.net.au/e1225ade186d2239101f1ffdeecc0f16?impolicy=wcms_watermark_news&cropH=1688&cropW=3000&xPos=0&yPos=156&width=862&height=485&imformat=generic,,"Residents in Jamaica are grappling with the scale of devastation wrought by Hurricane Melissa, as the storm moves into the Atlantic and starts to weaken.
The hurricane made landfall in Jamaica on Tu… [+3892 chars]",
e1f31059d7e4509dc0430fd9cf2122e8,2025-10-29T21:30:50Z,'landslide',japantoday.com,en,0.0,"Hurricane Melissa leaves dozens dead in trail of destruction across Cuba, Haiti and Jamaica","Hurricane Melissa left at least dozens dead and widespread destruction across Cuba, Haiti and Jamaica, where roofless homes, toppled utility poles and water-logged furniture dominated the landscape Wednesday. A landslide blocked the main roads of Santa Cruz i…",https://japantoday.com/category/world/hurricane-melissa-makes-landfall-in-eastern-cuba-as-a-category-3-storm,,,"Hurricane Melissa left at least dozens dead and widespread destruction across Cuba, Haiti and Jamaica, where roofless homes, toppled utility poles and water-logged furniture dominated the landscape W… [+6221 chars]",
545bb5918dc4e21e5f4437a84bac01f4,2025-10-30T16:00:00Z,'landslide road',www.thestar.com.my,en,0.0,Post-landslide road restrictions burden villagers,"BALIK PULAU: Vehicle weight and size restrictions imposed on Jalan Teluk Bahang here following recent landslides have made life miserable for many villagers, with some traders having to make repeated trips using two-wheelers, or use very long diversions. Read…",https://www.thestar.com.my/news/nation/2025/10/31/post-landslide-road-restrictions-burden-villagers,https://apicms.thestar.com.my/uploads/images/2025/10/31/3598433.jpg,,"BALIK PULAU: Vehicle weight and size restrictions imposed on Jalan Teluk Bahang here following recent landslides have made life miserable for many villagers, with some traders having to make repeated… [+2874 chars]",
03d13d6cf5d9885611d1282fd9823d75,2025-10-30T16:10:41Z,'landslide',en.protothema.gr,en,0.0,"Endless thriller in Valtonera, Amyntaio, Florina: The sinkholes “swallow” the houses","The great landslide of 2017, the findings of Efthymios Lekkas and five other agencies highlighting the need for immediate expropriations and relocation of residents – The “cry of anguish” of the villagers and their judicial vindication, yet the unexplained in…",https://en.protothema.gr/2025/10/30/endless-thriller-in-valtonera-amyntaio-florina-the-sinkholes-swallow-the-houses/,https://en.protothema.gr/wp-content/uploads/2025/10/baltonero-xrm-1.jpg-1.jpg,,"Valtonera. A village 12 kilometers from Amyntaio, Florina, but much closerjust 1,800 meters from the PPC (Public Power Corporation) mine in the area. Like other villages and settlements in the region… [+7939 chars]",
90e1827d85cda34e48938091c30e4d93,2025-10-30T17:31:09Z,'landslide death',nypost.com,en,0.1,"Hurricane Melissa leaves trail of death, destruction across Cuba, Haiti and Jamaica","Hurricane Melissa left at least dozens dead and caused widespread destruction across Cuba, Haiti, and Jamaica.",https://nypost.com/2025/10/30/world-news/hurricane-melissa-leaves-trail-of-death-destruction-across-cuba-haiti-and-jamaica/,https://nypost.com/wp-content/uploads/sites/2/2025/10/114486791.jpg?quality=75&strip=all&w=1200,,"SANTIAGO DE CUBA, Cuba (AP)  Hurricane Melissa left at least dozens dead and caused widespread destruction across Cuba, Haiti, and Jamaica, where roofless homes, toppled utility poles, and water-logg… [+7512 chars]",
19105667be2de7617cfa89deef28dd0b,2025-10-31T02:43:32Z,'landslide',www.abc.net.au,en,0.0,Houses flattened after landslide strikes Papua New Guinean village,"Police say 21 people have been killed in a landslide in Papua New Guinea's highlands overnight, with bodies still being recovered.",https://www.abc.net.au/news/2025-10-31/papua-new-guinea-landslide-kukas-enga-province/105957220,https://live-production.wcms.abc-cdn.net.au/eaf4a3771c9bbd5af97d690cc95ccf1a?impolicy=wcms_watermark_news&cropH=430&cropW=765&xPos=0&yPos=254&width=862&height=485&imformat=generic,,"Police say 21 people have been killed in a landslide in Papua New Guinea's highlands overnight, with bodies still being recovered.
They say the landslide struck the small village of Kukas in Enga Pr… [+1365 chars]",
72deb9eb596592a494c962767fbdf236,2025-10-31T04:03:48Z,'landslide',english.khabarhub.com,en,0.0,Landslide near Tuin Khola blocks Muglin–Narayangadh road,"CHITWAN: Vehicular movement along the Muglin–Narayangadh road section has been disrupted after a landslide occurred near Tuin Khola bridge. According to Chitwan Police, the landslide debris has blocked both lanes of the busy highway, halting all traffic movem…",https://english.khabarhub.com/2025/31/503602/,https://english.khabarhub.com/wp-content/uploads/2025/09/Tuinkhola-e1758781651183.jpg,,"CHITWAN: Vehicular movement along the MuglinNarayangadh road section has been disrupted after a landslide occurred near Tuin Khola bridge.
According to Chitwan Police, the landslide debris has block… [+557 chars]",
0d81ab8498173b9291bdaf0457b140f6,2025-10-31T05:13:09Z,'landslide road',english.khabarhub.com,en,0.0,Muglin–Narayangadh road reopens after landslide clearance,"CHITWAN: The Muglin–Narayangadh road section near Tuin Khola bridge has reopened after being briefly blocked by a landslide on Thursday. The road was cleared within half an hour, according to authorities. Ishwar Chhetri, supervisor at the Road Division Office…",https://english.khabarhub.com/2025/31/503605/,https://english.khabarhub.com/wp-content/uploads/2025/10/Muglin–Narayangadh-road-tuin-khola.jpg,,"CHITWAN: The MuglinNarayangadh road section near Tuin Khola bridge has reopened after being briefly blocked by a landslide on Thursday. The road was cleared within half an hour, according to authorit… [+198 chars]",
