index,published,keyword,domain,language,valid,title,description,url,image,archive,content,quote
ae5dc294796b9540a352476593c471e4,2025-10-11T17:34:49Z,'landslide rain',www.yahoo.com,en,0.0,"Heavy rain in Mexico sets off floods and landslides, killing at least 37","The death toll from landslides and floods set off by incessant rainfall in central and southeastern Mexico rose to 37 people on Saturday, authorities said, a...",https://www.yahoo.com/news/articles/heavy-rain-mexico-sets-off-173449798.html,https://s.yimg.com/cv/apiv2/social/images/yahoo_default_logo-1200x1200.png,,"MEXICO CITY (AP) The death toll from landslides and floods set off by incessant rainfall in central and southeastern Mexico rose to 37 people on Saturday, authorities said, a sharp increase as thousa… [+1040 chars]",
d8d151f8e0b029d24b23ea9757533941,2025-10-11T21:15:00Z,'landslide death',www.dailysignal.com,en,0.1,Why Won’t Virginia Democrats Call for Jones to Quit AG Race?,"Virginians with even a modicum of decency were rightly repulsed by vile 2022 text messages from Jay Jones, the Democrat nominee for state attorney general,... Read More
The post Why Won’t Virginia Democrats Call for Jones to Quit AG Race? appeared first on Th…",https://www.dailysignal.com/2025/10/11/why-wont-virginia-democrats-call-jones-quit-ag-race/,https://www.dailysignal.com/wp-content/uploads/2025/10/20251010_AbbyLovesJay.jpg,http://web.archive.org/web/20251011220442/https://www.dailysignal.com/2025/10/11/why-wont-virginia-democrats-call-jones-quit-ag-race/,"Virginians with even a modicum of decency were rightly repulsed by vile 2022 text messages from Jay Jones, the Democrat nominee for state attorney general, made public last week, in which he wished f… [+5776 chars]",
8ab61a78fdfe3ea24ec64f84ccb609ec,2025-10-11T21:26:05Z,'landslide',abcnews.go.com,en,0.0,"Heavy rain in Mexico sets off floods and landslides, killing at least 37",Authorities say the death toll from landslides and floods set off by incessant rainfall in central and southeastern Mexico has increased to 37 people,https://abcnews.go.com/International/wireStory/heavy-rain-mexico-sets-off-floods-landslides-killing-126432814,https://s.abcnews.com/images/US/abc_news_default_2000x2000_update_16x9_992.jpg,http://web.archive.org/web/20251011221842/https://abcnews.go.com/International/wireStory/heavy-rain-mexico-sets-off-floods-landslides-killing-126432814,"MEXICO CITY -- MEXICO CITY (AP) The death toll from landslides and floods set off by incessant rainfall in central and southeastern Mexico rose to 37 people on Saturday, authorities said, a sharp inc… [+1057 chars]",
841dbd537db9cef81866872df355001a,2025-10-11T22:30:30Z,'landslide rain',dpa-international.com,en,0.0,Dozens dead in Mexico after severe flooding; escaped tiger caught,"Heavy rainfall in Mexico caused severe flooding and landslides across several states, leaving at least 37 people dead, authorities said on Saturday. The...",https://dpa-international.com/general-news/urn:newsml:dpa.com:20090101:251011-99-302204/,https://media.zenfs.com/en/dpa_international_526/428edb845c4fc8dfbe2a285fffa28466,http://web.archive.org/web/20251011235223/https://dpa-international.com/general-news/urn:newsml:dpa.com:20090101:251011-99-302204/,"Heavy rainfall in Mexico caused severe flooding and landslides across several states, leaving at least 37 people dead, authorities said on Saturday.
The Security Ministry said 117 cities and municip… [+2248 chars]",
d7bd2f0ddc637c63ded4ab959d7d10e8,2025-10-12T04:06:14Z,'landslide',www.abc.net.au,en,0.0,"At least 41 dead in Mexico after landslides, floods","Authorities have attributed the deadly downpours to Tropical Storm Priscilla, formerly a hurricane, and Tropical Storm Raymond, both off the western coast of Mexico.",https://www.abc.net.au/news/2025-10-12/dozens-dead-in-mexico-veracruz-after-landslides-floods/105882420,https://live-production.wcms.abc-cdn.net.au/e0e4e02e0d79db5898f062339eb6583c?impolicy=wcms_watermark_news&cropH=2813&cropW=5000&xPos=0&yPos=241&width=862&height=485&imformat=generic,,"Some Mexicans in the low-lying working class neighbourhoods of Poza Rica heard the wall of water before they saw it. 
The loudest sound was from the cars crashing together as they were swept along b… [+3161 chars]",
4d2e0c0042a8ec13a333868e1476f3b3,2025-10-12T06:14:07Z,'landslide',www.hurriyetdailynews.com,en,0.0,"Heavy rain in Mexico sets off floods and landslides, killing at least 42","The death toll from landslides and floods set off by incessant rainfall in central and southeastern Mexico rose to 42 people on Saturday, authorities said, a sharp increase as thousands of soldiers cleared blocked roads to rescue around 27 missing individuals.",https://www.hurriyetdailynews.com/heavy-rain-in-mexico-sets-off-floods-and-landslides-killing-at-least-42-214567,https://image.hurimg.com/i/hurriyet/75/200x200/68eb47271e627480a0040195.jpg,http://web.archive.org/web/20251012085422/https://www.hurriyetdailynews.com/heavy-rain-in-mexico-sets-off-floods-and-landslides-killing-at-least-42-214567,"POZA RICA
The death toll from landslides and floods set off by incessant rainfall in central and southeastern Mexico rose to 42 people on Saturday, authorities said, a sharp increase as thousands of… [+2953 chars]",
dc80a4056d9870e30acb25d90ce66bf1,2025-10-12T11:40:29Z,'landslide',www.foxnews.com,en,0.0,"Floods, landslides in Mexico leave at least 41 dead",At least 41 people died in central and southeastern Mexico after heavy rainfall caused devastating floods and landslides across multiple states.,https://www.foxnews.com/world/floods-landslides-mexico-leave-dead,https://static.foxnews.com/foxnews.com/content/uploads/2025/10/mexico-floods-landslides-2.jpg,,"At least 41 people are dead in central and southeastern Mexico after days of torrential rainfall triggered floods and landslides, authorities said Saturday.
The death toll rose as thousands of soldi… [+1809 chars]",
d41296abf41b4bafdf6ad19c47da5358,2025-10-12T21:57:50Z,'landslide rain',www.yahoo.com,en,0.0,Mexico's president convenes governors as death toll from torrential rains rises to 44,"The death toll from Mexico's torrential rains increased to 44 on Sunday as the fallout mounted from flooding and landslides across the country, prompting...",https://www.yahoo.com/news/articles/mexicos-president-convenes-governors-death-215750304.html,https://s.yimg.com/ny/api/res/1.2/_5QO2iREqmmp6asQ3ypgOA--/YXBwaWQ9aGlnaGxhbmRlcjt3PTEyMDA7aD04MDA7Y2Y9d2VicA--/https://media.zenfs.com/en/ap.org/f9759e4bfd11ea8bce6384e404b440c0,,"MEXICO CITY (AP) The death toll from Mexico's torrential rains increased to 44 on Sunday as the fallout mounted from flooding and landslides across the country, prompting President Claudia Sheinbaum … [+1338 chars]",
f78d7e159fdc6e151e0b0c8b191daa4f,2025-10-13T00:57:21Z,'landslide',economictimes.indiatimes.com,en,0.0,Mexico's president convenes governors as death toll from torrential rains rises to 44,Torrential rains have claimed 44 lives across Mexico. Flooding and landslides have devastated several states. President Claudia Sheinbaum is coordinating an emergency response. Rescue operations are underway in affected areas. Many residents face water and el…,https://economictimes.indiatimes.com/news/international/world-news/mexicos-president-convenes-governors-as-death-toll-from-torrential-rains-rises-to-44/articleshow/124514937.cms,"https://img.etimg.com/thumb/msid-124514939,width-1200,height-630,imgsize-226986,overlay-economictimes/articleshow.jpg",,"The death toll from Mexico's torrential rains rose to 44 on Sunday as the fallout mounted from flooding and landslides across the country, prompting President Claudia Sheinbaum to convene governors f… [+1759 chars]",
4fb2dd2b33b0046a2a9dd85a5be5d602,2025-10-13T03:22:36Z,'landslide',abcnews.go.com,en,0.0,Mexico's president convenes governors as death toll from torrential rains rises to 44,"The death toll from Mexico’s torrential rains has increased to 44, as the fallout mounted from widespread flooding and landslides across the country",https://abcnews.go.com/International/wireStory/mexicos-president-convenes-governors-death-toll-torrential-rains-126459393,https://i.abcnewsfe.com/a/22ae3e87-d470-4e00-a22b-76a8331042e3/wirestory_e1cfd6acf28e38bf442d7eb14ada64ee_16x9.jpg?w=1600,,"POZA RICA, Mexico -- POZA RICA, Mexico (AP) The death toll from Mexico's torrential rains rose to 44 on Sunday as the fallout mounted from flooding and landslides across the country, prompting Presid… [+1730 chars]",
09b4de6e337530504ab54ce05be1e4b3,2025-10-13T12:09:05Z,'landslide death',people.com,en,0.0,At Least 47 Dead and 38 Missing After Torrential Rains and Landslides Strike Multiple Regions of Mexico,"The death toll from relentless rainfall across Mexico reached 47 as of Sunday, Oct. 12",https://people.com/47-dead-torrential-rain-multiple-regions-mexico-11828818,https://s.yimg.com/ny/api/res/1.2/68V5Du9PVFw5JATOLc7KIA--/YXBwaWQ9aGlnaGxhbmRlcjt3PTEyMDA7aD04MDA7Y2Y9d2VicA--/https://media.zenfs.com/en/people_218/a584117ab15f78986634e6433a180179,,"NEED TO KNOW
<ul><li>On Sunday, Oct. 12, the death toll from heavy rainfall across Mexico rose to 47 people
</li><li>According to local reports, at least 38 people remain missing in three different… [+2741 chars]",
350be5fea1535c7c33267fb7561ec6aa,2025-10-13T14:19:19Z,'landslide salvage',www.yahoo.com,en,0.1,Death toll from torrential rains in Mexico rises to 64 as search operations expand,"The death toll from last week’s torrential rains in east-central Mexico jumped to 64 Monday, as search operations expanded to communities cut off by...",https://www.yahoo.com/news/articles/death-toll-torrential-rains-mexico-141919732.html,https://s.yimg.com/ny/api/res/1.2/5KfynKQ99UGpmSW5OUZyzQ--/YXBwaWQ9aGlnaGxhbmRlcjt3PTEyMDA7aD04MDA7Y2Y9d2VicA--/https://media.zenfs.com/en/ap.org/a0459561819a17eadabef8dcef4e7810,,"POZA RICA, Mexico (AP) The death toll from last weeks torrential rains in east-central Mexico jumped to 64 Monday, as search operations expanded to communities cut off by landslides and residents in … [+1008 chars]",
bdcd1b1a71bf831281e7dbc8a1a8ee04,2025-10-13T14:48:58Z,'landslide',www.breitbart.com,en,0.0,VIDEO -- Tragic: 64 Dead in Mexico After Devastating Floods and Landslides,"Numerous people are dead in Mexico after heavy rains caused flooding and landslides, and video footage shows the devastation left behind. 
The post VIDEO — Tragic: 64 Dead in Mexico After Devastating Floods and Landslides appeared first on Breitbart.",https://www.breitbart.com/weather/2025/10/13/video-tragic-64-dead-in-mexico-after-devastating-floods-and-landslides/,https://media.breitbart.com/media/2025/10/mexico-floods-640x335.jpg,,"Numerous people are dead in Mexico after heavy rains caused flooding and landslides, and video footage shows the devastation left behind.
The Associated Press (AP) reported Sunday that authorities a… [+2047 chars]",
d874cbe512eafcd7a5a29cf1670d7634,2025-10-13T15:35:00Z,'landslide',nypost.com,en,0.0,"Mexico searches for missing people after torrential rains, at least 47 dead","The death toll from Mexico’s torrential rains rose to 47 on Sunday as the fallout mounted from flooding and landslides in different states around the country, as the authorities were rushing to help affected residents, look for missing people and try to clean…",https://nypost.com/2025/10/13/world-news/mexico-searches-for-missing-people-after-torrential-rains/,https://nypost.com/wp-content/uploads/sites/2/2025/10/newspress-collage-35bypk7th-1760368782979.jpg?quality=75&strip=all&1760354422&w=1024,,"The death toll from Mexicos torrential rains rose to 47 on Sunday as the fallout mounted from flooding and landslides in different states around the country, as the authorities were rushing to help a… [+2538 chars]",
019fc5371e5e2303145705e48cb8cf9c,2025-10-13T15:58:43Z,'landslide salvage',abcnews.go.com,en,0.1,Death toll from torrential rains in Mexico rises to 64 as search operations expand,The death toll from last week’s torrential rains in east-central Mexico has jumped to 64,https://abcnews.go.com/International/wireStory/death-toll-torrential-rains-mexico-rises-64-search-126476916,https://i.abcnewsfe.com/a/232eeffc-cc69-42c4-b396-6acf817a646d/wirestory_3f125942393d7deaab15334fe2766be8_16x9.jpg?w=1600,,"POZA RICA, Mexico -- POZA RICA, Mexico (AP) The death toll from last weeks torrential rains in Mexico jumped to 64 on Monday, as searches expanded to communities previously cut off by landslides.
An… [+1342 chars]",
40caa034a7eed28b037af055f7efd018,2025-10-13T16:51:45Z,'landslide protection',www.bostonherald.com,en,0.1,Death toll from torrential rains in Mexico rises to 64 as search operations expand,Authorities on Monday said 65 people are missing.,https://www.bostonherald.com/2025/10/13/mexico-rains-deaths/,https://www.bostonherald.com/wp-content/uploads/2025/10/APTOPIX_Mexico_Extreme_Weather_33726.jpg?w=1024&h=682,,"POZA RICA, Mexico (AP) The death toll from last weeks torrential rains in Mexico jumped to 64 on Monday, as searches expanded to communities previously cut off by landslides.
Another 65 people were … [+1466 chars]",
44d7a7a550d62430200143ccb9ac7ebf,2025-10-14T01:12:10Z,'landslide protection',economictimes.indiatimes.com,en,0.1,Death toll from torrential rains in Mexico rises to 64 as search expands,"Torrential rains have caused devastating floods across five Mexican states.  Poza Rica, an oil town, faces the added challenge of oil residue contaminating homes and streets.  Sixty-four people have died, and 65 are missing.  Thousands of homes are damaged.  …",https://economictimes.indiatimes.com/news/international/world-news/death-toll-from-torrential-rains-in-mexico-rises-to-64-as-search-expands/articleshow/124540890.cms,"https://img.etimg.com/thumb/msid-124540988,width-1200,height-630,imgsize-358860,overlay-economictimes/articleshow.jpg",,"Fifteen minutes before water from a flooded stream swept into her home, Lilia Ramirez took off running with what little she could carry. When she returned she found not only damage from the water tha… [+2815 chars]",
bbaa24deb9fe2f64270b08134ec2eab3,2025-10-14T03:22:44Z,'landslide protection',www.abc.net.au,en,0.1,Almost 130 people dead or missing in Mexico floods,"The death toll from flooding in Mexico's central region has risen to 64, with another 65 people missing, according to the Mexican government.",https://www.abc.net.au/news/2025-10-14/dozens-dead-after-torrential-rains-lash-mexico/105889300,https://live-production.wcms.abc-cdn.net.au/1fafe00dd4106d92af389e3c9bac583f?impolicy=wcms_watermark_news&cropH=2561&cropW=4552&xPos=0&yPos=345&width=862&height=485&imformat=generic,,"The death toll from flooding in Mexico's central region has risen to 64, with another 65 people missing, according to the Mexican government.
Torrential rains lashed parts of the country's Gulf Coas… [+3754 chars]",
ca46958e3bf290a7d7a614a8f73e0910,2025-10-14T05:03:38Z,'landslide death',www.npr.org,en,0.1,Death toll from torrential rains in Mexico rises to 64 as search expands,"Mexico has deployed some 10,000 troops in addition to civilian rescue teams. Helicopters have ferried food and water to the 200 some communities that remained cut off by ground.",https://www.npr.org/2025/10/14/g-s1-93322/death-toll-torrential-rains-mexico,https://npr.brightspotcdn.com/dims3/default/strip/false/crop/7008x3942+0+365/resize/1400/quality/100/format/jpeg/?url=http%3A%2F%2Fnpr-brightspot.s3.amazonaws.com%2F3d%2Fe0%2Fe23f87514bf195e609c9cd9be2df%2Fap25286766137907.jpg,,"POZA RICA, Mexico Fifteen minutes before water from a flooded stream swept into her home, Lilia Ramírez took off running with what little she could carry. When she returned she found not only damage … [+2775 chars]",
3bc270a764a99dce7810bc1a35cd8dc6,2025-10-14T06:25:25Z,'landslide protection',www.aljazeera.com,en,0.1,Death toll from devastating Mexico flooding rises,The death toll from last week’s torrential rains in Mexico has risen to 64 as authorities expand the search.,https://www.aljazeera.com/gallery/2025/10/14/death-toll-from-devastating-mexico-flooding-rises,https://www.aljazeera.com/wp-content/uploads/2025/10/AP25285847510440-1760419775.jpg?resize=1920%2C1440,,"Torrential rain battered several Mexican states over several days last week, turning streets into rivers, sweeping away roads and bridges and triggering landslides.
Rescuers scrambled on Monday to r… [+1477 chars]",
ff2d1715585c3eb4d3c1ebfb09287721,2025-10-14T16:15:09Z,'landslide protection',english.khabarhub.com,en,0.1,Today’s News in a Nutshell,"KATHMANDU: Khabarhub brings you a glimpse of major developments of the day in Nepal, including politics, business/economy, sports, entertainment, and more. Process begins to bring Bipin Joshi’s body back to Nepal The process of repatriating the body of Nepali…",https://english.khabarhub.com/2025/14/501338/,https://english.khabarhub.com/wp-content/uploads/2024/05/News-Nutshell.jpg,,"KATHMANDU: Khabarhub brings you a glimpse of major developments of the day in Nepal, including politics, business/economy, sports, entertainment, and more.
Process begins to bring Bipin Joshis body … [+15755 chars]",
69b90796426d8f5057c3ef2184a7cdaf,2025-10-14T17:03:21Z,'landslide',www.ibtimes.com,en,0.0,"Survivors In Flood-hit Mexico Need Food, Fear More Landslides",Cira Gonzalez survived a landslide that struck last week but fears her house could still collapse at any moment following torrential rains that have left 129 people dead or missing in Mexico.,https://www.ibtimes.com/survivors-flood-hit-mexico-need-food-fear-more-landslides-3786960,https://d.ibtimes.com/en/full/4628451/local-walks-past-landslide-entrance-town-san-bartolo-tutotepec-hidalgo-state-mexico.jpg,,"Cira Gonzalez survived a landslide that struck last week but fears her house could still collapse at any moment following torrential rains that have left 129 people dead or missing in Mexico.
Gonzal… [+2877 chars]",
1591f22746e1fc79dd7acf19186a9159,2025-10-14T20:35:55Z,'landslide protection',www.pbs.org,en,0.1,Death toll from flooding in Mexico rises above 60 as search expands,"Authorities say some 100,000 homes across the region have been damaged by the torrential rains and flooding.",https://www.pbs.org/newshour/world/death-toll-from-flooding-in-mexico-rises-above-60-as-search-expands,https://d3i6fh83elv35t.cloudfront.net/static/2025/10/2025-10-12T062305Z_1558418783_RC2P9HA30LHQ_RTRMADP_3_MEXICO-FLOODS-1024x684.jpg,,"POZA RICA, Mexico (AP) Fifteen minutes before water from a flooded stream swept into her home, Lilia Ramírez took off running with what little she could carry. When she returned she found not only da… [+3046 chars]",
787ca909f99380c22cfac3be093a1dac,2025-10-15T14:00:00Z,'landslide protection',journals.plos.org,en,0.1,Automated software bug severity classification using ensemble machine learning scheme: A real case study,"Software bug report classification is one of the most significant processes in software development for determining the nature and severity of faults based on their causes and effects. In many projects, software experts implement this process manually, which …",https://journals.plos.org/plosone/article?id=10.1371/journal.pone.0330510,https://journals.plos.org/plosone/article/figure/image?id=10.1371/journal.pone.0330510.g012&size=inline,,"Abstract
Software bug report classification is one of the most significant processes in software development for determining the nature and severity of faults based on their causes and effects. In m… [+51954 chars]",
4e4c95a7583e857628525c18c0119c25,2025-10-15T18:06:17Z,'landslide',www.ibtimes.com,en,0.0,"Flood-hit Mexican Town Digs Out Debris, Fearing Disease Outbreaks","Mexican survivors of floods and landslides that killed at least 66 people last week have appealed for urgent aid, saying they are worried about disease outbreaks as rotting animal carcasses pile up in the mud.",https://www.ibtimes.com/flood-hit-mexican-town-digs-out-debris-fearing-disease-outbreaks-3787161,https://d.ibtimes.com/en/full/4628850/street-mexican-town-huehuetla-where-flooding-caused-heavy-rains-caused-widespread-devastation.jpg,,"Mexican survivors of floods and landslides that killed at least 66 people last week have appealed for urgent aid, saying they are worried about disease outbreaks as rotting animal carcasses pile up i… [+2180 chars]",
5ed5a1dbd0b5668889decb22680b6f36,2025-10-15T19:20:42Z,'landslide protection',www.msnbc.com,en,0.1,The Jan. 6 attack gets in the way of Republican Party talking points (again),"There have been jokes about Republicans forgetting who was president in 2020, but the GOP’s habit of forgetting about the Jan. 6 attack is far less funny.",https://www.msnbc.com/rachel-maddow-show/maddowblog/jan-6-attack-gets-way-republican-party-talking-points-rcna237847,"https://media-cldnry.s-nbcnews.com/image/upload/t_nbcnews-fp-1200-630,f_auto,q_auto:best/rockcms/2025-10/251014-january-6-zz-2ca5f2.jpg",,"Three weeks after Rep.-elect Adelita Grijalva cruised to a landslide victory, the Arizona Democrat is eager to be sworn in and get to work. House Speaker Mike Johnson, meanwhile, continues to block G… [+4073 chars]",
573819351f46df492ebf82e8168e05fd,2025-10-16T02:00:00Z,'landslide protection',www.politico.eu,en,0.1,Geert Wilders’ one-man rule — and what that means for the Dutch,How Europe’s smallest party became the Netherlands’ largest political force.,https://www.politico.eu/article/geert-wilders-one-man-rule-what-that-means-for-dutch-party-of-freedom/,"https://www.politico.eu/cdn-cgi/image/width=1200,height=630,fit=crop,quality=80,onerror=redirect/wp-content/uploads/2025/10/08/Geert-Wilders-Joker-final-ONLINE.png",,"The Party for Freedom was never meant to be a team effort. From the start, Geert Wilders made sure of that.
In 2006, the Dutch politician registered the party with two members, the minimum required … [+14761 chars]",
ddf4f702e45432a0dc1808d83e2c2f29,2025-10-16T18:58:32Z,'landslide protection',financialpost.com,en,0.1,Trans Mountain faces $292k environmental fines after 2024 B.C. rainstorm: regulator,"Trans Mountain is facing $292,000 in regulatory fines for alleged environmental issues in January 2024 along a stretch of its British Columbia pipeline expansion route hit by a major rainstorm. The Canada Energy Regulator posted four penalties dated Oct. 3 to…",https://financialpost.com/pmn/trans-mountain-faces-292k-environmental-fines-after-2024-b-c-rainstorm-regulator,,,"Trans Mountain is facing $292,000 in regulatory fines for alleged environmental issues in January 2024 along a stretch of its British Columbia pipeline expansion route hit by a major rainstorm.
THIS… [+5007 chars]",
1cf1c5081f49ee15f08dd5febceaffea,2025-10-16T20:41:53Z,'rock fall',consequence.net,en,0.0,Former KISS Guitarist Ace Frehley on Life Support: Report,"The rock legend apparently suffered a brain bleed following a fall at his studio.
Former KISS Guitarist Ace Frehley on Life Support: Report
Spencer Kaufman",https://consequence.net/2025/10/kiss-ace-frehley-life-support-report/,https://consequence.net/wp-content/uploads/2024/01/ace-frehley-new-album-10000-volts.jpg,,"Former KISS guitarist Ace Frehley is on life support after suffering a brain bleed following a recent fall at his studio, reports TMZ.
Earlier this month, we reported that Frehley canceled the remai… [+651 chars]",
b72c0db06c6454e8938261ce426cc7ee,2025-10-16T22:15:16Z,'rock fall',consequence.net,en,0.0,"Ace Frehley, Legendary Founding KISS Guitarist, Dead at 74","The rock legend passed away after suffering brain bleed following a fall at his studio.
Ace Frehley, Legendary Founding KISS Guitarist, Dead at 74
Spencer Kaufman",https://consequence.net/2025/10/ace-frehley-kiss-guitarist-dead/,https://consequence.net/wp-content/uploads/2023/12/ace-frehley-2020.jpg,,"Ace Frehley, the legendary founding guitarist of KISS, has died at the age of 74 after reportedly suffering a brain bleed following a recent fall at his studio.
“We are completely devastated and hea… [+2919 chars]",
857118150ec450282fe5de5400ead66e,2025-10-16T22:22:12Z,'rock fall',deadline.com,en,0.0,Ace Frehley Dies: Kiss Founding Guitarist Was 74,"Ace Frehley, who co-founded the rock band Kiss and was its lead guitarist for eight years and nine studio albums and two live discs, died today after spending several weeks hospitalized for a fall. He was 74. Frehley had been on life support with a brain blee…",http://deadline.com/2025/10/ace-frehley-dead-kiss-guitarist-1236589795/,https://deadline.com/wp-content/uploads/2025/10/GettyImages-1315248644.jpg?w=1024,,"Ace Frehley, who co-founded the rock band Kiss and was its lead guitarist for eight years and nine studio albums and two live discs, died today after spending several weeks hospitalized for a fall. H… [+1419 chars]",
1e931ed1a62569cb22ca8fc12ff0f59a,2025-10-16T23:56:29Z,'rock fall',www.tmz.com,en,0.0,"KISS Guitarist Ace Frehley Remembered By Bandmates, Rock Legends","Ace Frehley, the original lead guitarist for KISS, died after being taken off a ventilator following a nasty fall and a brain bleed ... and tributes are pouring in from tons of rockers, including his KISS bandmates Gene Simmons and Paul Stanley. In…",https://www.tmz.com/2025/10/16/kiss-guitarist-ace-frehley-remembered-by-rock-legends/,https://imagez.tmz.com/image/a4/16by9/2025/10/16/a4cea3475210480390633efc03b4fdc1_xl.jpg,,"Ace Frehley, the original lead guitarist for KISS, died after being taken off a ventilator following a nasty fall and a brain bleed ... and tributes are pouring in from tons of rockers, including his… [+1988 chars]",
