index,published,keyword,domain,language,valid,title,description,url,image,archive,content,quote,de,en,la,added
8d468daad7134d65b8cf0230a1d1eca6,2025-12-14T01:00:16Z,'landslide',www.koin.com,en,0.9,‘Pure devastation’ of OR 229 landslide displaces residents as officials assess damage,"PORTLAND, Ore. (KOIN) — A community is in recovery mode after a massive landslide displaced residents and impacted several homes on Friday morning. The...",https://www.koin.com/news/oregon/pure-devastation-of-or-229-landslide-displaces-residents-as-officials-assess-damage/,https://media.zenfs.com/en/koin_articles_940/34fa5280dd2a8c22d88195066af559ab,,"PORTLAND, Ore. (KOIN) A community is in recovery mode after a massive landslide displaced residents and impacted several homes on Friday morning.
The landslide happened on OR 229, near milepost 14, … [+3078 chars]",,"„Reine Verwüstung“ durch Erdrutsch in OR 229 führt zur Vertreibung von Anwohnern, während Beamte den Schaden bewerten. PORTLAND, Oregon (KOIN) – Eine Gemeinde befindet sich im Erholungsmodus, nachdem am Freitagmorgen ein massiver Erdrutsch Bewohner vertrieben und mehrere Häuser in Mitleidenschaft gezogen hatte. Der...","‘Pure devastation’ of OR 229 landslide displaces residents as officials assess damage. PORTLAND, Ore. (KOIN) — A community is in recovery mode after a massive landslide displaced residents and impacted several homes on Friday morning. The...","Item 'pura devastatio' OR 229 lapsus deponit incolas ut magistratus damnum assident. PORTLAND, Ore (KOIN) — Communitas in modo recuperandi post ingentem ruinam incolarum expositam et complures domos die Veneris mane impacta est. The...",2025-12-17 10:23:18+00:00
43b7dd828d9b01c346057e96d88c37c9,2025-12-14T01:58:33Z,'landslide',www.thesportingtribune.com,en,0.9,"No.16 USC no match for No.1 UConn, fall in landslide 79-51","LOS ANGELES -- On all facets of this game, the No.",https://www.thesportingtribune.com/2025/12/13/no16-usc-no-match-for-no1-uconn-fall-in-landslide-79-51-,https://media.zenfs.com/en/the_sporting_tribune_articles_423/82ec6bc989dde7457241210634adffe4,,"LOS ANGELES -- On all facets of this game, the No.16 USC Trojans Women's basketball squad was simply outplayed by the best team in the country, the Connecticut Huskies, and as a result, the Women of … [+2038 chars]",,"Nr. 16 USC kann nicht mit Nr. 1 UConn mithalten, fällt mit einem Erdrutsch von 79-51. LOS ANGELES – In allen Facetten dieses Spiels ist die Nr.","No.16 USC no match for No.1 UConn, fall in landslide 79-51. LOS ANGELES -- On all facets of this game, the No.","No.16 USC impares No.1 UConn, cadunt in LAPSUS 79-51. LOS ANGELES -- In omnibus ludi huius spectaculis, in No.",2025-12-17 10:23:18+00:00
c531d63cdd4b469c83adb2becc81441c,2025-12-14T11:11:00Z,'landslide',www.thestar.com.my,en,0.9,"Flood situation improves in Sarawak, only two relief centre remains","MIRI: The number of flood and landslide victims in Sarawak continues to decrease, with only two temporary relief centres (PPS) still operating in Miri. Read full story",https://www.thestar.com.my/news/nation/2025/12/14/flood-situation-improves-in-sarawak-only-two-relief-centre-remains,https://apicms.thestar.com.my/uploads/images/2025/12/14/3671983.jpg,,"MIRI: The number of flood and landslide victims in Sarawak continues to decrease, with only two temporary relief centres still operating in Miri.
As of 4pm on Sunday (Dec 14), the Sarawak State Disa… [+485 chars]",,"Die Überschwemmungssituation in Sarawak verbessert sich, es sind nur noch zwei Hilfszentren übrig. MIRI: Die Zahl der Opfer von Überschwemmungen und Erdrutschen in Sarawak geht weiter zurück, und in Miri sind nur noch zwei temporäre Hilfszentren (PPS) in Betrieb. Lesen Sie die ganze Geschichte","Flood situation improves in Sarawak, only two relief centre remains. MIRI: The number of flood and landslide victims in Sarawak continues to decrease, with only two temporary relief centres (PPS) still operating in Miri. Read full story","Diluvii condicio in Sarawak melioratur, duo tantum media subsidia restant. MIRI: Numerus inundationum et victimarum lapsus in Sarawak decrescere pergit, cum sola duo centra temporalia subsidia (PPS) adhuc in Miri operantur. Read full story",2025-12-17 10:23:18+00:00
b4dc0d482fd405b9d0c7b37479c0dc4d,2025-12-14T13:00:00Z,'landslide',www.cbc.ca,en,0.9,‘It’s really sad’: B.C. community still reeling 1 year after fatal landslide in Lions Bay,"It's been a year since Barbara and David Enns died after a landslide destroyed their home in the Village of Lions Bay. An RCMP investigation into the slide is ongoing, and the Enns' children and two neighbours have filed a lawsuit against the province, the mu…",https://www.cbc.ca/news/canada/british-columbia/lions-bay-landslide-anniversary-9.7015046,"https://i.cbc.ca/ais/be55b2ab-6d61-4eeb-a623-67fc1a138deb,1765668012637/full/max/0/default.jpg?im=Crop%2Crect%3D%280%2C0%2C1920%2C1080%29%3BResize%3D620",http://web.archive.org/web/20251215011927/https://www.cbc.ca/news/canada/british-columbia/lions-bay-landslide-anniversary-9.7015046,"Barbara and David Enns were long-time residents and well-known in the tight-knit community of Lions Bay, where their tragic deaths are still deeply felt one year later. 
On Dec. 14, 2024, a landslid… [+4930 chars]",,"„Es ist wirklich traurig“: B.C. Die Gemeinde ist auch ein Jahr nach dem tödlichen Erdrutsch in Lions Bay immer noch in Aufruhr. Es ist ein Jahr her, seit Barbara und David Enns starben, nachdem ein Erdrutsch ihr Haus im Dorf Lions Bay zerstört hatte. Eine RCMP-Untersuchung des Rutschens ist im Gange, und die Kinder der Enns und zwei Nachbarn haben eine Klage gegen die Provinz, die Gemeinde, eingereicht.","‘It’s really sad’: B.C. community still reeling 1 year after fatal landslide in Lions Bay. It's been a year since Barbara and David Enns died after a landslide destroyed their home in the Village of Lions Bay. An RCMP investigation into the slide is ongoing, and the Enns' children and two neighbours have filed a lawsuit against the province, the mu…","'Est vere tristis': B.C. Communitas adhuc I nutat anno post fatalem ruinam in Lions Bay. Annus suus fuit ex quo Barbara et David Enns mortui sunt postquam lapsus domum suam in Leonum pago Sinus delevit. Investigatio RCMP in lapsu continuatur, et filii Enns et duo vicini causam contra provinciam petiverunt, mu…",2025-12-17 10:23:18+00:00
df8daf430a16de024d7a6e1d99ed0ecc,2025-12-14T14:45:43Z,'landslide',hawkeyeswire.usatoday.com,en,0.9,Iowa women’s basketball signee named winner of National POY fan vote,Iowa women’s basketball signee McKenna Woliczko named Sporting News’ National Player of the Year fan vote by a landslide victory,https://hawkeyeswire.usatoday.com/story/sports/college/hawkeyes/womens-basketball/2025/12/14/iowa-womens-basketball-mckenna-woliczko-national-player-of-the-year-fan-vote/87753336007/,https://s.yimg.com/ny/api/res/1.2/TQNQxKocEL6gsM5_vLXHlQ--/YXBwaWQ9aGlnaGxhbmRlcjt3PTEyMDA7aD04MTU7Y2Y9d2VicA--/https://media.zenfs.com/en/hawkeyes_wire_usa_today_articles_405/ec8ae6220e5fc8d3b2144aa29cc41dac,,"Following a massive wave of votes primarily from Iowa women's basketball fans, Hawkeyes' 2026 signee McKenna Woliczko was named as Sporting News' preseason frontrunner for the 2025-26 Naismith Girls … [+2359 chars]",,"Die Unterzeichnerin des Frauenbasketballs aus Iowa wurde zur Gewinnerin der nationalen POY-Fanabstimmung gekürt. McKenna Woliczko, Spielerin des Frauenbasketballs aus Iowa, wurde von Sporting News mit einem Erdrutschsieg zur Fan-Wahl zur Nationalspielerin des Jahres gekürt",Iowa women’s basketball signee named winner of National POY fan vote. Iowa women’s basketball signee McKenna Woliczko named Sporting News’ National Player of the Year fan vote by a landslide victory,Iowa feminarum ultrices signum nomine victor suffragio ventilationis Nationalis POY. Iowa feminarum ultrices signum McKenna Woliczko nominavit News lusorium Nationale Ludi suffragii ventilationis per victoriam in landslide,2025-12-17 10:23:18+00:00
f4e4a67f729e14629c76fb7817d5a7b7,2025-12-14T23:36:33Z,'landslide',biztoc.com,en,0.9,Conservative hardliner wins Chile’s presidential election in landslide,José Antonio Kast will be country’s most rightwing president in 35 years of democracy,https://biztoc.com/x/b732c55f98c69cc1,https://biztoc.com/cdn/b732c55f98c69cc1_s.webp,,"José Antonio Kast will be countrys most rightwing president in 35 years of democracy
This story appeared on ft.com, 2025-12-14 23:28:18.",,Konservativer Hardliner gewinnt erdrutschartig die Präsidentschaftswahl in Chile. José Antonio Kast wird der rechteste Präsident des Landes in 35 Jahren Demokratie sein,Conservative hardliner wins Chile’s presidential election in landslide. José Antonio Kast will be country’s most rightwing president in 35 years of democracy,Hardliner conservativus Chile electionem praesidentialem in landslide vincit. José Antonio Kast praesidens patriae rectissimus in XXXV annis democratiae erit,2025-12-17 10:23:18+00:00
56e03e3fafe49850bd54937c8c26455a,2025-12-15T05:00:17Z,'landslide',english.gossiplankanews.com,en,0.9,"Body of Netuki, Missing in Landslide, Recovered","The body of a young girl, who went missing in the landslide that occurred on November 27 in the Berannawa, Thennawatta area, belonging to the Yatiyanthota Divisional Secretariat, was found yesterday (14) afternoon. The deceased has been identified as seven-ye…",https://english.gossiplankanews.com/2025/12/body-of-netuki-missing-in-landslide.html,https://lh3.googleusercontent.com/blogger_img_proxy/AEn0k_u1q0-1caXnX4uNphrYWJ5CSGGV1KCECD6BkC-Hf-moPHZ0eFnHBg3stb4ReoTmTHEC8zR50NUNcChh7Z6MLprICjPWVNshcgPGT4bXjrMNeZzUY8urxm-Ga7uS3kSN5PrLidbcDFHu8kNomSb7Cu3bpoJPKbQ=w1600,,"The body of a young girl, who went missing in the landslide that occurred on November 27 in the Berannawa, Thennawatta area, belonging to the Yatiyanthota Divisional Secretariat, was found yesterday … [+1013 chars]",,"Leiche von Netuki, bei Erdrutsch vermisst, geborgen. Die Leiche eines jungen Mädchens, das bei dem Erdrutsch am 27. November im Gebiet Berannawa, Thennawatta, das zum Abteilungssekretariat Yatiyanthota gehörte, verschwunden war, wurde gestern (14) Nachmittag gefunden. Der Verstorbene wurde als Siebenjähriger identifiziert.","Body of Netuki, Missing in Landslide, Recovered. The body of a young girl, who went missing in the landslide that occurred on November 27 in the Berannawa, Thennawatta area, belonging to the Yatiyanthota Divisional Secretariat, was found yesterday (14) afternoon. The deceased has been identified as seven-ye…","Corpus Netuki, Absentis in Landslide, Recovery. Corpus puellae, quae in propatulo abiit, quod die 27 mensis Novembris in Berannawa, Thennawatta regio, ad Yatiyanthota secretariatum Divisionalem pertinens, periit, hesterno die (14) post meridiem repertum est. Defunctus notus est ut septem...",2025-12-17 10:23:18+00:00
