index,published,keyword,domain,language,valid,title,description,url,image,archive,content,quote,de,en,la,added
17e059870e14e961dd2306cceab31217,2026-01-25T03:29:00Z,'landslide',www.thestar.com.my,en,0.9,Indonesia resumes search for 80 after landslide kills 10 in West Java,"WEST ‌BANDUNG, Indonesia, Jan 25 (Reuters) - Indonesian authorities resumed search-and-rescue ‌efforts for 80 people missing after a ‌landslide killed 10 in a residential area of West Java province. Read full story",https://www.thestar.com.my/news/world/2026/01/25/indonesia-resumes-search-for-80-after-landslide-kills-10-in-west-java,https://apicms.thestar.com.my/uploads/images/2026/01/25/3736971.jpg,,"WEST BANDUNG, Indonesia, Jan 25 (Reuters) - Indonesian authorities resumed search-and-rescue efforts for 80 people missing after a landslide killed 10 in a residential area of West Java province.
Th… [+1136 chars]",,"Indonesien nimmt die Suche nach 80 Menschen wieder auf, nachdem bei einem Erdrutsch in West-Java zehn Menschen getötet wurden. WEST ‌BANDUNG, Indonesien, 25. Januar (Reuters) – Die indonesischen Behörden haben die Such- und Rettungsbemühungen für 80 vermisste Menschen wieder aufgenommen, nachdem bei einem Erdrutsch in einem Wohngebiet in der Provinz West-Java zehn Menschen ums Leben gekommen waren. Lesen Sie die ganze Geschichte","Indonesia resumes search for 80 after landslide kills 10 in West Java. WEST ‌BANDUNG, Indonesia, Jan 25 (Reuters) - Indonesian authorities resumed search-and-rescue ‌efforts for 80 people missing after a ‌landslide killed 10 in a residential area of West Java province. Read full story","Indonesia repetit inquisitionem 80 postquam lapsu ruinae 10 in Java Java. WEST ‌BANDUNG, Indonesia, 25 Jan. Read full story",2026-01-26 05:32:43+00:00
a4049011fb669ffc4e4fb703cf49b025,2026-01-25T04:10:00Z,'landslide',www.thestar.com.my,en,0.9,Recovery of New Zealand landslide victims halted on safety concerns,"SYDNEY, Jan 25 (Reuters) - New ‌Zealand authorities suspended recovery efforts on Sunday for ‌victims of a landslide that hit a busy ‌campground on the country's North Island. Read full story",https://www.thestar.com.my/news/world/2026/01/25/recovery-of-new-zealand-landslide-victims-halted-on-safety-concerns,https://apicms.thestar.com.my/uploads/images/2026/01/25/3736977.jpg,,"SYDNEY, Jan 25 (Reuters) - New Zealand authorities suspended recovery efforts on Sunday for victims of a landslide that hit a busy campground on the country's North Island.
Six people, including two… [+1203 chars]",,"Die Bergung der Opfer eines Erdrutschs in Neuseeland wurde aus Sicherheitsgründen gestoppt. SYDNEY, 25. Januar (Reuters) – Die neuseeländischen Behörden haben am Sonntag die Bergungsbemühungen für die Opfer eines Erdrutschs eingestellt, der einen belebten Campingplatz auf der Nordinsel des Landes getroffen hatte. Lesen Sie die ganze Geschichte","Recovery of New Zealand landslide victims halted on safety concerns. SYDNEY, Jan 25 (Reuters) - New ‌Zealand authorities suspended recovery efforts on Sunday for ‌victims of a landslide that hit a busy ‌campground on the country's North Island. Read full story","Recuperatio victimarum Novae Zelandiae in prolapso salutis cura constitit. Sydney, Jan 25 (Reuters) - Auctoritates novae Zealand intermissae conatum recuperandi die Dominico pro victimatibus lapsus qui occupant campground in regione septentrionali Islandiae feriunt. Read full story",2026-01-26 05:32:43+00:00
5b6b3f4843a94233a8adefb1278aae9e,2026-01-25T04:30:13Z,'landslide',punchng.com,en,0.9,Final round of Myanmar vote set to seal junta ally’s victory,"Myanmar’s final election round begins, with the pro-military party poised for a landslide victory in a vote critics say will legitimize the junta’s rule.

Read More: https://punchng.com/final-round-of-myanmar-vote-set-to-seal-junta-allys-victory/",https://punchng.com/final-round-of-myanmar-vote-set-to-seal-junta-allys-victory/,https://cdn.punchng.com/wp-content/uploads/2026/01/25054910/AFP__20260125__93WN7YN__v1__Mockup__MyanmarVote-1200x630.jpg,,"Myanmar opened the final round of its month-long election on Sunday, with the dominant pro-military party on course for a landslide in a junta-run vote critics say will prolong the army’s grip on pow… [+4287 chars]",,"Die letzte Runde der Abstimmung in Myanmar soll den Sieg des Junta-Verbündeten besiegeln. Die letzte Wahlrunde in Myanmar beginnt, und die pro-militärische Partei steht vor einem Erdrutschsieg bei einer Abstimmung, die nach Ansicht von Kritikern die Herrschaft der Junta legitimieren wird.

Lesen Sie mehr: https://punchng.com/final-round-of-myanmar-vote-set-to-seal-junta-allys-victory/","Final round of Myanmar vote set to seal junta ally’s victory. Myanmar’s final election round begins, with the pro-military party poised for a landslide victory in a vote critics say will legitimize the junta’s rule.

Read More: https://punchng.com/final-round-of-myanmar-vote-set-to-seal-junta-allys-victory/","Finalis rotundus de Myanmar suffragium posuit ut victoriam socium juntae obsignaret. Myanmar's finalis electio circum incipit, cum factione pro-militaria quae critici pro-militarem victoriam in suffragiis dicunt dicent legitimam regulam juntae erunt.

Lege More: https://punchng.com/final-round-of-myanmar-vote-set-to-seal-junta-allys-victory/",2026-01-26 05:32:43+00:00
0d3ab9d65ba91153ad6db1639e074d82,2026-01-25T04:33:04Z,'landslide',www.channelnewsasia.com,en,0.9,Recovery of New Zealand landslide victims halted on safety concerns,A crack found at the site at Mount Maunganui prompted recovery work to cease for the day.,https://www.channelnewsasia.com/world/new-zealand-landslide-campsite-missing-dead-mount-maunganui-5881466,"https://dam.mediacorp.sg/image/upload/s--3C7AbjXM--/c_crop,h_449,w_799,x_1,y_34/c_fill,g_auto,h_676,w_1200/fl_relative,g_south_east,l_mediacorp:cna:watermark:2024-04:reuters_1,w_0.1/f_auto,q_auto/v1/one-cms/core/2026-01-25T040523Z_1_LYNXMPEM0O01F_RTROPTP_3_NEWZEALAND-WEATHER.JPG?itok=X10lhNCF",,"SYDNEY: New Zealand authorities suspended recovery efforts on Sunday (Jan 25) for victims of a landslide that hit a busy campground on the country's North Island.
Six people, including two teenagers… [+745 chars]",,"Die Bergung der Opfer eines Erdrutschs in Neuseeland wurde aus Sicherheitsgründen gestoppt. Ein am Standort Mount Maunganui entdeckter Riss führte dazu, dass die Bergungsarbeiten für einen Tag eingestellt wurden.",Recovery of New Zealand landslide victims halted on safety concerns. A crack found at the site at Mount Maunganui prompted recovery work to cease for the day.,Recuperatio victimarum Novae Zelandiae in prolapso salutis cura constitit. Fisma in situ apud Montem Mauganui inventam recuperationem operis ad cessandum in die excitavit.,2026-01-26 05:32:43+00:00
bd6b086ce92b6c3d02d4a91781e36d7b,2026-01-25T04:34:26Z,'landslide',japantoday.com,en,0.9,Recovery of New Zealand landslide victims halted on safety concerns,"New Zealand authorities suspended recovery efforts on Sunday for victims ‌of a landslide that hit a busy campground on the country's North Island. Six people, including two ⁠teenagers, are presumed dead after heavy ‍rains triggered Thursday's landslide at ‍Mo…",https://japantoday.com/category/world/recovery-of-new-zealand-landslide-victims-halted-on-safety-concerns,,,"New Zealand authorities suspended recovery efforts on Sunday for victims of a landslide that hit a busy campground on the country's North Island.
Six people, including two teenagers, are presumed de… [+1132 chars]",,"Die Bergung der Opfer eines Erdrutschs in Neuseeland wurde aus Sicherheitsgründen gestoppt. Die neuseeländischen Behörden haben am Sonntag die Bergungsbemühungen für die Opfer eines Erdrutschs eingestellt, der einen belebten Campingplatz auf der Nordinsel des Landes erschütterte. Es wird angenommen, dass sechs Menschen, darunter zwei Teenager, ums Leben kamen, nachdem heftige Regenfälle den Erdrutsch am Donnerstag in ‍Mo… ausgelöst hatten.","Recovery of New Zealand landslide victims halted on safety concerns. New Zealand authorities suspended recovery efforts on Sunday for victims ‌of a landslide that hit a busy campground on the country's North Island. Six people, including two ⁠teenagers, are presumed dead after heavy ‍rains triggered Thursday's landslide at ‍Mo…","Recuperatio victimarum Novae Zelandiae in prolapso salutis cura constitit. Novae Zelandiae auctoritates suspensae sunt conatum recuperandi die Dominico de victimis - de lapsu qui occupatissimum campum in patriae insulae septentrionalis feriunt. Sex homines, inter duos adulescentes, mortui praesumuntur post imbres graves urguebant Iovis in Mo…",2026-01-26 05:32:43+00:00
1886bbef32ed99b7880320a2a258ac05,2026-01-25T09:42:07Z,'landslide protection',en.antaranews.com,en,0.9,"Ministry prioritizes safety of women, children after Cisarua landslide",The Ministry of Women&#39;s Empowerment and Child Protection (PPPA) ensures the protection and fulfillment of the rights of women and children affected by the ...,https://en.antaranews.com/news/401554/ministry-prioritizes-safety-of-women-children-after-cisarua-landslide,https://cdn.antaranews.com/cache/1200x800/2026/01/25/177334.jpg,,Bandung (ANTARA) - The Ministry of Women's Empowerment and Child Protection (PPPA) ensures the protection and fulfillment of the rights of women and children affected by the landslide in Cisarua Sub-… [+1814 chars],,"Nach dem Erdrutsch in Cisarua legt das Ministerium großen Wert auf die Sicherheit von Frauen und Kindern. Das Ministerium für Frauenförderung und Kinderschutz (PPPA) gewährleistet den Schutz und die Wahrung der Rechte von Frauen und Kindern, die von der ... betroffen sind.","Ministry prioritizes safety of women, children after Cisarua landslide. The Ministry of Women&#39;s Empowerment and Child Protection (PPPA) ensures the protection and fulfillment of the rights of women and children affected by the ...","Ministratio prioritizat salutem feminarum, filii post Cisarua proruit. Ministerium Mulierum &#39;s Empowerment et Puer Praesidium (PPPA) tuetur et adimpletur iuribus mulierum et puerorum ab ... affectis.",2026-01-26 10:26:05+00:00
eb3f909e175cf13d34ed3be7a6ddc5cf,2026-01-22T03:41:26Z,'landslide',abcnews.go.com,en,0.9,Rescue efforts underway after landslides hit New Zealand campground and house,Landslides have hit a campground and a house in New Zealand and emergency crews are trying to rescue people buried in rubble,https://abcnews.go.com/International/wireStory/rescue-efforts-underway-after-landslides-hit-new-zealand-129438465,https://i.abcnewsfe.com/a/38afd49f-a2b8-492c-ad65-fb330b701a21/wirestory_adf7342fac9b80f854dd575520930d5d_16x9.jpg?w=1600,http://web.archive.org/web/20260123035650/https://abcnews.go.com/International/wireStory/rescue-efforts-underway-after-landslides-hit-new-zealand-129438465,"MELBOURNE, Australia -- Landslides hit a campground and a house in New Zealand and emergency crews were trying to rescue people buried in rubble, officials said Thursday.
Emergency services were cal… [+2314 chars]",,"Rettungsmaßnahmen sind im Gange, nachdem Erdrutsche Campingplatz und Haus in Neuseeland erschüttert haben. Erdrutsche haben einen Campingplatz und ein Haus in Neuseeland erschüttert und Rettungskräfte versuchen, in Trümmern verschüttete Menschen zu retten",Rescue efforts underway after landslides hit New Zealand campground and house. Landslides have hit a campground and a house in New Zealand and emergency crews are trying to rescue people buried in rubble,Eripe nisus comparatis postquam proruit Novae Zelandiae campground et domum. Landslides campground percusserunt et domum in Nova Zelandia et nautae subitis homines in ruderibus sepultos eripere conantur,2026-01-27 01:46:57+00:00
6d1b8ffde117a3d9a3860573abeed201,2026-01-22T09:55:38Z,'landslide road',www.cbc.ca,en,0.9,Rescue efforts underway after landslides hit New Zealand campground and house,"Landslides hit a campground and a house in New Zealand and emergency crews were trying to rescue people buried in rubble, officials said Thursday.",https://www.cbc.ca/news/world/landslide-new-zealand-camground-9.7055667,"https://i.cbc.ca/ais/e43930eb-97d5-4bfc-83b2-82c0b68ab767,1769070099246/full/max/0/default.jpg?im=Crop%2Crect%3D%280%2C2%2C3001%2C1688%29%3BResize%3D620",http://web.archive.org/web/20260122103714/https://www.cbc.ca/news/world/landslide-new-zealand-camground-9.7055667,"Rescue workers combed rubble on Thursday at a campsite in New Zealand as they searched for the missing, children among them, after a landslide triggered by heavy rains that snapped power links to tho… [+2538 chars]",,"Rettungsmaßnahmen sind im Gange, nachdem Erdrutsche Campingplatz und Haus in Neuseeland erschüttert haben. Erdrutsche erschütterten einen Campingplatz und ein Haus in Neuseeland und Einsatzkräfte versuchten, in Trümmern verschüttete Menschen zu retten, sagten Beamte am Donnerstag.","Rescue efforts underway after landslides hit New Zealand campground and house. Landslides hit a campground and a house in New Zealand and emergency crews were trying to rescue people buried in rubble, officials said Thursday.","Eripe nisus comparatis postquam proruit Novae Zelandiae campground et domum. Prolapsi campground percusserunt et domum in Nova Zelandia et nautae tumultuantes homines in ruderibus sepultos eripere conabantur, ministri Iovis dixerunt.",2026-01-27 01:46:57+00:00
988120ff6d09a10846dae9a3202eccab,2026-01-23T02:24:05Z,'landslide',www.bbc.com,en,0.9,Teens among the missing after landslide at campsite in New Zealand,The search continues for missing people after a landslide hit a popular campsite in Mount Maunganui.,https://www.bbc.com/news/articles/c14rr5pnd80o,https://ichef.bbci.co.uk/news/1024/branded_news/c76c/live/a3944610-f7ff-11f0-a233-1340054e59bc.jpg,http://web.archive.org/web/20260124105428/https://www.bbc.com/news/articles/c14rr5pnd80o,"The search continues for missing people after a landslide hit a popular campsite in Mount Maunganui, on New Zealand's North Island.
Six people remain unaccounted for, and police are seeking informat… [+2330 chars]",,"Jugendliche unter den Vermissten nach Erdrutsch auf Campingplatz in Neuseeland. Die Suche nach vermissten Personen geht weiter, nachdem ein Erdrutsch einen beliebten Campingplatz in Mount Maunganui erschüttert hat.",Teens among the missing after landslide at campsite in New Zealand. The search continues for missing people after a landslide hit a popular campsite in Mount Maunganui.,Pubescentem inter absentes cum campsite in Nova Zelandia. Inquisitio pergit ut homines absentis postquam ruina popularem campum in Monte Maunganui percusserit.,2026-01-27 01:46:57+00:00
a2fd531f74246021abcdc101219c1a15,2026-01-23T07:12:04Z,'landslide',www.rte.ie,en,0.9,Rescuers dig for six missing in New Zealand landslide,Rescuers are continuing to dig into deep mud searching for at least six missing people after a landslide from an extinct volcano crashed into a popular campsite in northern New Zealand.,https://www.rte.ie/news/2026/0123/1554639-new-zealand-landslide/,https://www.rte.ie/images/0023c8d2-1600.jpg,http://web.archive.org/web/20260124055752/https://www.rte.ie/news/2026/0123/1554639-new-zealand-landslide/,"Rescuers are continuing to dig into deep mud searching for at least six missing people after a landslide from an extinct volcano crashed into a popular campsite in northern New Zealand.
Police said … [+2778 chars]",,"Retter suchen nach sechs Vermissten bei Erdrutsch in Neuseeland. Retter graben weiterhin im tiefen Schlamm auf der Suche nach mindestens sechs Vermissten, nachdem ein Erdrutsch eines erloschenen Vulkans einen beliebten Campingplatz im Norden Neuseelands erschüttert hat.",Rescuers dig for six missing in New Zealand landslide. Rescuers are continuing to dig into deep mud searching for at least six missing people after a landslide from an extinct volcano crashed into a popular campsite in northern New Zealand.,Reservatores sex absentes in LAPSA Nova Zelandia foderunt. Reservatores in altum lutum fodere pergunt quaerentes saltem sex homines absentis postquam lapsu ex vulcano extincti ingruunt in campum popularem in septentrionali Nova Zelandia.,2026-01-27 01:46:57+00:00
2a132268827883a90a062855b1888074,2026-01-23T07:35:10Z,'landslide',www.aljazeera.com,en,0.9,Six missing after landslide hits New Zealand campsite,Officials have warned the search for the missing could take several days.,https://www.aljazeera.com/news/2026/1/23/six-missing-after-landslide-hits-new-zealand-campsite,https://www.aljazeera.com/wp-content/uploads/2026/01/reuters_6973189e-1769150622.jpg?resize=1920%2C1440,http://web.archive.org/web/20260123181046/https://www.aljazeera.com/news/2026/1/23/six-missing-after-landslide-hits-new-zealand-campsite,"Six people, including two teenagers, are missing after a landslide struck a busy campground on New Zealands North Island, as rescue teams continued searching through debris, authorities have said.
T… [+3056 chars]",,"Sechs Vermisste nach Erdrutsch auf neuseeländischem Campingplatz. Beamte haben gewarnt, dass die Suche nach den Vermissten mehrere Tage dauern könnte.",Six missing after landslide hits New Zealand campsite. Officials have warned the search for the missing could take several days.,Sex missing post LAPSUS percusserit Novae Zelandiae campsite. Magistratus monuerunt inquisitionem absentis complures dies capere posse.,2026-01-27 01:46:57+00:00
1a9682c2bbed25fafe10c5e775c0aaa0,2026-01-23T07:36:16Z,'landslide',www.thejournal.ie,en,0.9,Rescue efforts continue for six missing people in New Zealand landslide,Police said a 15-year-old was the youngest person unaccounted for.,https://www.thejournal.ie/rescue-efforts-continue-new-zealand-landslide-6935897-Jan2026/,https://img2.thejournal.ie/article/6935897/river/?height=400&version=6935902,http://web.archive.org/web/20260124081458/https://www.thejournal.ie/rescue-efforts-continue-new-zealand-landslide-6935897-Jan2026/,"RESCUERS HAVE DUG into deep mud searching for at least six missing people after a landslide from an extinct volcano crashed into a popular campsite in northern New Zealand.
Police said a 15-year-old… [+2860 chars]",,Die Rettungsbemühungen für sechs vermisste Menschen nach einem Erdrutsch in Neuseeland gehen weiter. Nach Angaben der Polizei handelte es sich bei einem 15-Jährigen um die jüngste vermisste Person.,Rescue efforts continue for six missing people in New Zealand landslide. Police said a 15-year-old was the youngest person unaccounted for.,Eripe nisus sex perseveres hominibus absentis in Novo Zelandiae lapsu. Aliquam dixit XV annos erat minimus homo inexplicabilis.,2026-01-27 01:46:57+00:00
380c81b9717c73c16a727d70b71633d8,2026-01-23T20:28:46Z,'landslide',www.abc.net.au,en,0.9,Anxious wait continues for families as New Zealand landslide search enters third day,"Authorities have vowed to continue searching for those missing in the disaster, as officials announce an official review into the incident.",https://www.abc.net.au/news/2026-01-24/new-zealand-landslide-search-at-mount-maunganui-enters-third-day/106264352,https://live-production.wcms.abc-cdn.net.au/79345255d28b037fe400031d048d7bcb?impolicy=wcms_watermark_news&cropH=1085&cropW=1929&xPos=60&yPos=280&width=862&height=485&imformat=generic,http://web.archive.org/web/20260123214859/https://www.abc.net.au/news/2026-01-24/new-zealand-landslide-search-at-mount-maunganui-enters-third-day/106264352,"Emergency services have worked through a second straight night trying to find those trapped underneath a landslide, which devastated a campsite on New Zealand's North Island.
Authorities confirmed o… [+2668 chars]",,"Das gespannte Warten der Familien geht weiter, während die Suche nach einem Erdrutsch in Neuseeland in den dritten Tag geht. Die Behörden haben versprochen, die Suche nach den bei der Katastrophe vermissten Personen fortzusetzen, da Beamte eine offizielle Überprüfung des Vorfalls ankündigen.","Anxious wait continues for families as New Zealand landslide search enters third day. Authorities have vowed to continue searching for those missing in the disaster, as officials announce an official review into the incident.","Anxia exspectatio pergit familias sicut Novae Zelandiae landum inquisitionis diem tertium intrat. Auctoritates voverunt investigationem continuare pro iis qui in calamitate absentis erant, ut ministri officialem recognitionem in rem nuntiarent.",2026-01-27 01:46:57+00:00
c9f21f971928b4cfe5fdfc7b388be65e,2026-01-26T00:23:00Z,'landslide',www.channelnewsasia.com,en,0.9,New Zealand resumes victim recovery efforts after fatal landslide,WELLINGTON: New Zealand police on Monday (Jan 26) restarted recovery efforts for the victims of a l,https://www.channelnewsasia.com/world/new-zealand-resume-victim-recovery-landslide-campsite-mount-maunganui-5882256,"https://dam.mediacorp.sg/image/upload/s--a7RL6-b9--/c_crop,h_450,w_800,x_0,y_14/c_fill,g_auto,h_676,w_1200/fl_relative,g_south_east,l_mediacorp:cna:watermark:2024-04:reuters_1,w_0.1/f_auto,q_auto/v1/one-cms/core/2026-01-24T010225Z_1_LYNXMPEM0N00L_RTROPTP_3_NEWZEALAND-WEATHER.JPG?itok=rbNyhFEK",,"WELLINGTON: New Zealand police on Monday (Jan 26) restarted recovery efforts for the victims of a landslide that hit a busy campground on the country's North Island last week.
Six people, including … [+1176 chars]",,Neuseeland nimmt die Bergungsbemühungen für Opfer nach einem tödlichen Erdrutsch wieder auf. WELLINGTON: Die neuseeländische Polizei hat am Montag (26. Januar) die Bergungsbemühungen für die Opfer eines Brandes wieder aufgenommen,New Zealand resumes victim recovery efforts after fatal landslide. WELLINGTON: New Zealand police on Monday (Jan 26) restarted recovery efforts for the victims of a l,Nova Zelandia repetit victimam recuperandi nisus post fatalem LAPSUS. WELLINGTON: Novae Zelandiae magistratus die Lunae (Ian. 26) restarted conatum recuperandi pro victimis l,2026-01-28 01:43:29+00:00
53f55dbd36a530202bf23630db6cdb60,2026-01-26T00:52:22Z,'landslide',www.nzherald.co.nz,en,0.9,Mount Maunganui slip: Council CEO responds to claim 111 call was referred to council before landslide,Details including who leads the independent review into the slip are expected this week.,https://www.nzherald.co.nz/nz/politics/mount-maunganui-slip-council-ceo-responds-to-claim-111-call-was-referred-to-council-before-landslide/RZ4R7MBYHJALZDIOABNNBMERSI/,https://www.nzherald.co.nz/resizer/v2/WG6OZTE2DBEDZOXJVREKVFKLF4.jpg?auth=9b7928300374d4ccaec86462500656feb30e7865640944402724daccdc67f707&width=1200&height=675&quality=70&smart=true,http://web.archive.org/web/20260126030608/https://www.nzherald.co.nz/nz/politics/mount-maunganui-slip-council-ceo-responds-to-claim-111-call-was-referred-to-council-before-landslide/RZ4R7MBYHJALZDIOABNNBMERSI/,"He said several tents were below the slip and he could see others walking on the maunga above the slip.
Fire and Emergency New Zealand deputy national commander Megan Stiffle today confirmed her sta… [+2723 chars]",,"Mount Maunganui-Ausrutscher: Der Vorstandsvorsitzende des Rates antwortet auf die Behauptung, der Notruf 111 sei vor dem Erdrutsch an den Rat weitergeleitet worden. Details, einschließlich der Person, die die unabhängige Überprüfung in den Zettel leitet, werden diese Woche erwartet.",Mount Maunganui slip: Council CEO responds to claim 111 call was referred to council before landslide. Details including who leads the independent review into the slip are expected this week.,Mons Maunganui lapsus: Consilium CEO respondet ad clamorem 111 vocatum relatum ad concilium ante ruina. Singula etiam quae recensionem independentem in lapsus ducit hac septimana exspectantur.,2026-01-28 01:43:29+00:00
8e4a667c411bda3c95d0e204d2130f06,2026-01-26T01:17:03Z,'landslide death',www.internazionale.it,en,0.9,Death toll from landslide in Indonesia’s West Java rises to 17,"JAKARTA, Jan 26 (Reuters) - The death toll from a landslide that hit Indonesia’s West Java province at the weekend rose to 17 on Monday, the country’s disaster mitigation… Leggi",https://www.internazionale.it/ultime-notizie-reuters/2026/01/26/death-toll-from-landslide-in-indonesia-s-west-java-rises-to-17,https://static.internazionale.it/assets/img/internazionale-icon.png,http://web.archive.org/web/20260126082005/https://www.internazionale.it/ultime-notizie-reuters/2026/01/26/death-toll-from-landslide-in-indonesia-s-west-java-rises-to-17,"JAKARTA, Jan 26 (Reuters) - The death toll from a landslide that hit Indonesias West Java province at the weekend rose to 17 on Monday, the countrys disaster mitigation agency said, with dozens still… [+1159 chars]",,"Zahl der Todesopfer durch Erdrutsch in der indonesischen Provinz West-Java steigt auf 17. JAKARTA, 26. Januar (Reuters) – Die Zahl der Todesopfer durch einen Erdrutsch, der am Wochenende die indonesische Provinz West-Java heimgesucht hat, ist am Montag auf 17 gestiegen, wie die Katastrophenvorsorge des Landes mitteilte","Death toll from landslide in Indonesia’s West Java rises to 17. JAKARTA, Jan 26 (Reuters) - The death toll from a landslide that hit Indonesia’s West Java province at the weekend rose to 17 on Monday, the country’s disaster mitigation… Leggi","Mortis vectigal ex landslide in Indonesia in West Java oritur 17. JAKARTA, Jan 26 (Reuters) - Mortis vectigal ex landslide qui in provincia occidentali Javae Indonesiae ledo surrexit, die 17 Lunae, calamitatis patriae mitigatio… Leggi",2026-01-28 01:43:29+00:00
